Date,Source,Headline,Sentiment_Score,Sentiment_Label
"Tue, 31 Mar 2026 07:00:00 GMT",Unknown,The Strait of Hormuz crisis is drawing eyes to another point nearby: ‘the Gate of Tears’,0.0,Neutral
"Tue, 31 Mar 2026 07:00:00 GMT",Unknown,Iran’s parliament committee approves Strait of Hormuz toll plan: Reports,0.0,Neutral
"Tue, 31 Mar 2026 07:00:00 GMT",Unknown,Trump Says Reopening the Strait of Hormuz Is Other Countries’ Problem,-0.12,Neutral
"Tue, 31 Mar 2026 07:00:00 GMT",Unknown,"Countries need to step up on Strait of Hormuz, says Hegseth",0.0,Neutral
"Tue, 31 Mar 2026 07:00:00 GMT",Unknown,Windward: Strait Of Hormuz Throughput Is Increasing,0.0,Neutral
"Tue, 31 Mar 2026 07:00:00 GMT",Unknown,Iran Exempts Malaysian Tankers from Strait of Hormuz Fee,-0.7,Negative
"Tue, 31 Mar 2026 07:00:00 GMT",Unknown,Trump Calls on Allies to Seize Hormuz as War Frustration Mounts,0.0,Neutral
"Tue, 31 Mar 2026 07:00:00 GMT",Unknown,Iran war: EU calls Tehran to discuss Strait of Hormuz,0.0,Neutral
"Mon, 30 Mar 2026 07:00:00 GMT",Unknown,"Bessent Says US to ‘Retake’ Hormuz Strait Control, Eyes Escorts",0.0,Neutral
"Mon, 30 Mar 2026 07:00:00 GMT",Unknown,Zelenskyy offers Ukraine’s help to unblock Hormuz,0.1,Neutral
"Tue, 31 Mar 2026 07:00:00 GMT",Unknown,How war in the Middle East has exposed the vulnerability of global choke points,0.04,Neutral
"Tue, 31 Mar 2026 07:00:00 GMT",Unknown,Strait Of Hormuz Blockage Refocuses TechnipFMC Outlook On Offshore Demand,0.0,Neutral
"Mon, 30 Mar 2026 07:00:00 GMT",Unknown,Why the Strait of Hormuz Closure Is an Asian Crisis,0.0,Neutral
"Tue, 31 Mar 2026 07:00:00 GMT",Unknown,Controlling the Strait of Hormuz is the top priority in Iran and Trump may abandon it. Here’s what that would look like,0.5,Positive
"Tue, 31 Mar 2026 07:00:00 GMT",Unknown,Trump says Iran war will end soon and Strait of Hormuz will ‘automatically open’,0.0,Neutral
"Mon, 30 Mar 2026 07:00:00 GMT",Unknown,Iran Advances Plan to Impose Tolls in Strait of Hormuz Amid War Disruptions,0.0,Neutral
"Tue, 31 Mar 2026 07:00:00 GMT",Unknown,Trump Tells Allies To 'Take' Strait Of Hormuz Themselves; Market Reacts,0.0,Neutral
"Tue, 31 Mar 2026 07:00:00 GMT",Unknown,Malaysia Says Iran Allowing Its Vessels to Pass Through Strait of Hormuz Toll-Free,0.0,Neutral
"Mon, 30 Mar 2026 07:00:00 GMT",Unknown,"Defense sources: Ending IDF war on Iran waits for Trump decision on Hormuz, nuke issue",0.0,Neutral
"Tue, 31 Mar 2026 07:00:00 GMT",Unknown,Rubio says US will keep Strait of Hormuz open,0.0,Neutral
"Tue, 31 Mar 2026 07:00:00 GMT",Unknown,Trump tells allies: 'Get your own oil' as Iran blocks Strait of Hormuz,0.6,Positive
"Tue, 31 Mar 2026 07:00:00 GMT",Unknown,Strait of Hormuz could see 'full normalization' in 6 to 8 weeks,0.35,Positive
"Tue, 31 Mar 2026 07:00:00 GMT",Unknown,Trump tells allies to ‘get your own oil’ as Iran continues blockade on Strait of Hormuz,0.6,Positive
"Tue, 31 Mar 2026 07:00:00 GMT",Unknown,Gulf leaders scramble for Hormuz work-around,0.0,Neutral
"Mon, 30 Mar 2026 07:00:00 GMT",Unknown,How does the ‘Tehran tollbooth’ upend Trump’s shifting Iran war plans?,0.0,Neutral
"Mon, 30 Mar 2026 07:00:00 GMT",Unknown,Ukraine Pitches its Own Solution to the Strait of Hormuz Shutdown,0.6,Positive
"Mon, 30 Mar 2026 07:00:00 GMT",Unknown,Low Washington farm profits driven even lower by Strait of Hormuz blockade | Spokane News,0.0,Neutral
"Tue, 31 Mar 2026 07:00:00 GMT",Unknown,"Strait of Hormuz shutdown: What implications for Europe, for how long and how high can prices go?",0.06,Neutral
"Tue, 31 Mar 2026 07:00:00 GMT",Unknown,"Would a US invasion of Hormuz, Kharg Island take weeks or months?",0.0,Neutral
"Tue, 31 Mar 2026 07:00:00 GMT",Unknown,UAE Considers Military Role To Reopen Strait Of Hormuz By Force,-0.1,Neutral
"Tue, 31 Mar 2026 02:32:31 GMT",Unknown,Iran War: The Strait of Hormuz Oil Shock Is Now Heading West,0.0,Neutral
"Tue, 31 Mar 2026 07:00:00 GMT",Unknown,Cosco boxships transit Hormuz on second attempt as Iran widens approved nation list,0.0,Neutral
"Tue, 31 Mar 2026 07:00:00 GMT",Unknown,From the Erie Canal to the Strait of Hormuz,0.0,Neutral
"Tue, 31 Mar 2026 07:00:00 GMT",Unknown,"Apostleship of the Sea: 20,000 sailors stranded near Strait of Hormuz ‘living in constant anguish’",0.05,Neutral
"Tue, 31 Mar 2026 07:00:00 GMT",Unknown,Trump Wavers on War Escalation,0.0,Neutral
"Tue, 31 Mar 2026 07:00:00 GMT",Unknown,Japan Considers Rerouting Caspian Oil Amid Strait of Hormuz Concerns,0.0,Neutral
"Tue, 31 Mar 2026 07:00:00 GMT",Unknown,Will Trump end Iran war without opening the Strait of Hormuz? : Here & Now Anytime,0.0,Neutral
"Tue, 31 Mar 2026 07:00:00 GMT",Unknown,"Ben Shapiro: ""The president knows that the Strait of Hormuz, if left in Iranian control, would allow for the Iranian government to rebuild and strengthen""",0.0,Neutral
"Tue, 31 Mar 2026 07:00:00 GMT",Unknown,Trump and Hegseth tell US allies to help open Strait of Hormuz,0.0,Neutral
"Tue, 31 Mar 2026 07:00:00 GMT",Unknown,"Iran moves to charge Hormuz traffic as US, Israel escalate pressure",0.0,Neutral
"Tue, 31 Mar 2026 07:00:00 GMT",Unknown,Trump piles on pressure on EU allies over securing Strait of Hormuz,0.0,Neutral
"Mon, 30 Mar 2026 07:00:00 GMT",Unknown,Iran’s ‘real nuclear weapon is their control’ of the Strait of Hormuz,0.2,Neutral
"Tue, 31 Mar 2026 07:00:00 GMT",Unknown,Iran’s parliament approves plan to impose toll on ships sailing through Strait of Hormuz — and it’s already charging up to $2 million,0.14,Neutral
"Tue, 31 Mar 2026 07:00:00 GMT",Unknown,Will Trump Surrender to Iran’s ‘Toll Booth’ Strategy?,0.0,Neutral
"Mon, 30 Mar 2026 07:00:00 GMT",Unknown,Second Time's the Charm as Iran Permits Chinese Boxships Through Hormuz,0.0,Neutral
"Tue, 31 Mar 2026 07:00:00 GMT",Unknown,Analysis | Will Trump strike over Hormuz or not?,0.0,Neutral
"Tue, 31 Mar 2026 07:00:00 GMT",Unknown,Does video show Pakistani-flagged tanker burning in Strait of Hormuz? Here's the truth,0.0,Neutral
"Mon, 30 Mar 2026 07:00:00 GMT",Unknown,Report: White House Considers Ending War Without Opening Strait of Hormuz,0.0,Neutral
"Tue, 31 Mar 2026 07:00:00 GMT",Unknown,Another Greek Oil Tanker Exits Hormuz Despite Iran’s Blockade,0.0,Neutral
"Tue, 31 Mar 2026 07:00:00 GMT",Unknown,"Live Q&A: Trump on Hormuz; Lebanon, counterattacks, the intel beat, and more : Sources & Methods",0.32,Positive
"Tue, 31 Mar 2026 07:00:00 GMT",Unknown,Six More Weeks of Choked Hormuz Supply Could Send Oil to $200,0.1,Neutral
"Tue, 31 Mar 2026 07:00:00 GMT",Unknown,Iran Approves Hormuz Control Plan—What Changes Now?,0.0,Neutral
"Tue, 31 Mar 2026 07:00:00 GMT",Unknown,Pakistan Weighs Hormuz Options After Iran Clears 20 Ships,0.0,Neutral
"Mon, 30 Mar 2026 07:00:00 GMT",Unknown,"Trump urges countries to ""take"" Hormuz as White House reportedly mulls Iran exit",0.0,Neutral
"Tue, 31 Mar 2026 07:00:00 GMT",Unknown,The 5 waterways that control global trade,0.0,Neutral
"Wed, 01 Apr 2026 07:00:00 GMT",Unknown,Beyond oil: 9 commodities impacted by the Strait of Hormuz crisis,0.2,Neutral
"Wed, 01 Apr 2026 07:00:00 GMT",Unknown,War and fishing in the Strait of Hormuz,0.0,Neutral
"Wed, 01 Apr 2026 07:00:00 GMT",Unknown,"Hormuz disruption deepens global economic strain across trade, prices and finance",0.1,Neutral
"Wed, 01 Apr 2026 07:00:00 GMT",Unknown,The Iran conflict’s energy shocks are not yet fully realized,0.0,Neutral
"Wed, 01 Apr 2026 07:00:00 GMT",Unknown,How the Conflict in the Strait of Hormuz Could Affect Global Agriculture Prices,0.0,Neutral
"Wed, 01 Apr 2026 07:00:00 GMT",Unknown,The Best- and Worst-Case Scenarios of Iran’s Strait of Hormuz Closure,1.0,Positive
"Wed, 01 Apr 2026 07:00:00 GMT",Unknown,Walking away from the Strait of Hormuz won’t make gas cheap again,0.4,Positive
"Wed, 01 Apr 2026 07:00:00 GMT",Unknown,"After Trump's claim of a ""present,"" data show most ships getting through Strait of Hormuz are linked to Iran",0.25,Positive
"Wed, 01 Apr 2026 07:00:00 GMT",Unknown,President Trump on Oil Prices and Strait of Hormuz,0.0,Neutral
"Wed, 01 Apr 2026 07:00:00 GMT",Unknown,The Strait of Hormuz offers a lesson in air denial,0.1,Neutral
"Wed, 01 Apr 2026 07:00:00 GMT",Unknown,Why Reopening the Strait of Hormuz Matters for the U.S. Economy,0.14,Neutral
"Wed, 01 Apr 2026 07:00:00 GMT",Unknown,The Iran war’s impacts on global fertilizer markets and food production,0.0,Neutral
"Wed, 01 Apr 2026 07:00:00 GMT",Unknown,What Iran’s Control of the Strait of Hormuz Means for the Global Economy,0.0,Neutral
"Wed, 01 Apr 2026 07:00:00 GMT",Unknown,The Islands That Give Iran a Stranglehold on the Strait of Hormuz,0.0,Neutral
"Wed, 01 Apr 2026 07:00:00 GMT",Unknown,Oil's worst-case scenario: $200 if Hormuz remains closed,-0.1,Neutral
"Wed, 01 Apr 2026 07:00:00 GMT",Unknown,Rubio: ‘We depend very little’ on Strait of Hormuz,-0.24,Negative
"Wed, 01 Apr 2026 07:00:00 GMT",Unknown,Is the Strait of Hormuz a ticking environmental time bomb?,0.0,Neutral
"Wed, 01 Apr 2026 07:00:00 GMT",Unknown,How high could oil and gas prices go if the Strait of Hormuz remains closed?,0.03,Neutral
"Wed, 01 Apr 2026 07:00:00 GMT",Unknown,Iran Update: The Strait of Hormuz Crisis and the Future of War,0.0,Neutral
"Wed, 01 Apr 2026 07:00:00 GMT",Unknown,UN / STRAIT OF HORMUZ UPDATE,0.0,Neutral
"Wed, 01 Apr 2026 07:00:00 GMT",Unknown,"To ‘Price In’ Hormuz, Markets Must Recognize Two Economic Risks",0.2,Neutral
"Wed, 01 Apr 2026 07:00:00 GMT",Unknown,Hormuz disruption will change trade — and defense — at other chokepoints,-0.12,Neutral
"Wed, 01 Apr 2026 07:00:00 GMT",Unknown,Devex Dish: Can the UN push lifesaving fertilizer through the Strait of Hormuz?,0.0,Neutral
"Wed, 01 Apr 2026 07:00:00 GMT",Unknown,Trump says war in Iran will not end until Strait of Hormuz is reopened,0.0,Neutral
"Wed, 01 Apr 2026 07:00:00 GMT",Unknown,Strait of Hormuz Blockade Snarls Supply Chains for Manufacturers,0.0,Neutral
"Wed, 01 Apr 2026 07:00:00 GMT",Unknown,How Iran's Hormuz Blockade Chokes Global Trade Beyond Oil And Gas,0.13,Neutral
"Wed, 01 Apr 2026 07:00:00 GMT",Unknown,Trump says any Iran ceasefire conditional on Strait of Hormuz reopening,0.0,Neutral
"Wed, 01 Apr 2026 07:00:00 GMT",Unknown,Opinion | The Strait of Hormuz is the U.S.’ problem now — whether Trump likes it or not,0.0,Neutral
"Wed, 01 Apr 2026 07:00:00 GMT",Unknown,Exclusive | U.A.E. Wants to Force Hormuz Open and Is Willing to Join the Fight,0.15,Neutral
"Wed, 01 Apr 2026 07:00:00 GMT",Unknown,Trump to allies who need access to Strait of Hormuz: 'Go get your own oil',0.6,Positive
"Wed, 01 Apr 2026 07:00:00 GMT",Unknown,"Trump Calls on Allies to Secure Strait of Hormuz, Says U.S. ‘Very Close’ to Achieving Iran Objectives",0.3,Positive
"Wed, 01 Apr 2026 07:00:00 GMT",Unknown,"UAE denies WSJ report that it is preparing to help US, allies open Strait of Hormuz by force",0.0,Neutral
"Wed, 01 Apr 2026 07:00:00 GMT",Unknown,US and Iran Dig in on War Demands as Hormuz Remains Closed,-0.1,Neutral
"Wed, 01 Apr 2026 07:00:00 GMT",Unknown,Trump: Strait of Hormuz will ‘open up naturally’ after war with Iran ends,0.05,Neutral
"Wed, 01 Apr 2026 07:00:00 GMT",Unknown,Iran War: UK's Starmer Pledges Push to Reopen Hormuz as Trump Aims More Barbs,0.5,Positive
"Wed, 01 Apr 2026 07:00:00 GMT",Unknown,French navy chief says China will have to engage more in Strait of Hormuz discussion,0.25,Positive
"Wed, 01 Apr 2026 07:00:00 GMT",Unknown,"UAE Asks UN to Approve Measures, Including Force, to Open Hormuz",0.0,Neutral
"Wed, 01 Apr 2026 07:00:00 GMT",Unknown,The Dilemma in Safeguarding the Strait of Hormuz,0.0,Neutral
"Wed, 01 Apr 2026 07:00:00 GMT",Unknown,"Japan, France agree to step up coordination on Hormuz, Iran war",0.0,Neutral
"Wed, 01 Apr 2026 07:00:00 GMT",Unknown,Secret Codes and Yuan Fees Get Ships Through Iran’s Hormuz Tollbooth,-0.4,Negative
"Wed, 01 Apr 2026 07:00:00 GMT",Unknown,How an Indian LPG tanker escaped Hormuz via an unusual route,0.2,Neutral
"Wed, 01 Apr 2026 07:00:00 GMT",Unknown,Iran's IRGC is Charging Millions in Cryptocurrency for Hormuz Transits,0.0,Neutral
"Wed, 01 Apr 2026 07:00:00 GMT",Unknown,35 nations to meet to discuss Hormuz reopening,0.0,Neutral
"Wed, 01 Apr 2026 07:00:00 GMT",Unknown,Britain to host summit on managing the Strait of Hormuz,0.0,Neutral
"Wed, 01 Apr 2026 07:00:00 GMT",Unknown,Trump Sets Strait of Hormuz Condition as Iran Signals Readiness for Ceasefire,0.0,Neutral
"Wed, 01 Apr 2026 07:00:00 GMT",Unknown,‘Matter of survival’: Philippines seeks safe Hormuz passage for vessels,0.5,Positive
"Wed, 01 Apr 2026 07:00:00 GMT",Unknown,Trump Resumes Strait of Hormuz Threats,0.0,Neutral
"Wed, 01 Apr 2026 07:00:00 GMT",Unknown,United Arab Emirates ready to help US open Strait of Hormuz by force: report,0.11,Neutral
"Wed, 01 Apr 2026 07:00:00 GMT",Unknown,How the Strait of Hormuz crisis could trigger Africa’s next major shock,0.03,Neutral
"Wed, 01 Apr 2026 07:00:00 GMT",Unknown,"By Choking the Strait of Hormuz, Iran Found America’s Weak Spot",-0.38,Negative
"Wed, 01 Apr 2026 07:00:00 GMT",Unknown,Iran says Strait of Hormuz transit to follow its terms,0.0,Neutral
"Thu, 02 Apr 2026 07:00:00 GMT",Unknown,Why the US Cannot Escape the Strait of Hormuz Trap,0.0,Neutral
"Thu, 02 Apr 2026 07:00:00 GMT",Unknown,Trump sends mixed messages on securing the Strait of Hormuz,0.0,Neutral
"Thu, 02 Apr 2026 07:00:00 GMT",Unknown,Control Over Strait of Hormuz Will Determine Who Wins the War,0.3,Positive
"Thu, 02 Apr 2026 07:00:00 GMT",Unknown,"Foreign Ministry Spokesperson Mao Ning’s Regular Press Conference on April 2, 2026",-0.06,Neutral
"Thu, 02 Apr 2026 07:00:00 GMT",Unknown,The Strait of Hormuz and the Power of Chokepoints,0.0,Neutral
"Thu, 02 Apr 2026 07:00:00 GMT",Unknown,Why the Strait of Hormuz is a geological wonder,0.0,Neutral
"Thu, 02 Apr 2026 07:00:00 GMT",Unknown,"Iran Says It Will Oversee Strait of Hormuz Traffic, Even in Peacetime",0.14,Neutral
"Wed, 01 Apr 2026 07:00:00 GMT",Unknown,The Hormuz Crisis and the Case for Reconnecting the Navy and Merchant Marine​,-0.1,Neutral
"Thu, 02 Apr 2026 07:00:00 GMT",Unknown,LIST: UK gathers 40+ countries to reopen Strait of Hormuz,0.0,Neutral
"Thu, 02 Apr 2026 07:00:00 GMT",Unknown,UK gathers more than 40 countries to press Iran to reopen the Strait of Hormuz,0.5,Positive
"Thu, 02 Apr 2026 07:00:00 GMT",Unknown,OPEC Figures Show Countries Most Affected by Hormuz,0.5,Positive
"Thu, 02 Apr 2026 07:00:00 GMT",Unknown,Zelenskiy offers Ukraine's maritime expertise with Strait of Hormuz,0.1,Neutral
"Thu, 02 Apr 2026 07:00:00 GMT",Unknown,Bypass the Strait of Hormuz with nuclear explosives? The US studied that in Panama and Colombia in the 1960s,0.0,Neutral
"Thu, 02 Apr 2026 07:00:00 GMT",Unknown,The Impact of the Iran Conflict on South Korea: By the Numbers,-0.05,Neutral
"Thu, 02 Apr 2026 07:00:00 GMT",Unknown,Why China May Be The Key To Unlock The Strait Of Hormuz,0.0,Neutral
"Thu, 02 Apr 2026 07:00:00 GMT",Unknown,Britain Says It Will Host Military Talks on Securing Strait of Hormuz,-0.02,Neutral
"Thu, 02 Apr 2026 07:00:00 GMT",Unknown,These 4 charts show why reopening the Strait of Hormuz is vital for the U.S. economy,0.1,Neutral
"Thu, 02 Apr 2026 07:00:00 GMT",Unknown,UK Convenes Meeting on Reopening Strait of Hormuz as Trump Reiterates Warning to Iran in National Address,0.0,Neutral
"Thu, 02 Apr 2026 07:00:00 GMT",Unknown,Which countries' ships are hit by Hormuz crisis?,0.0,Neutral
"Thu, 02 Apr 2026 07:00:00 GMT",Unknown,Iran and Oman drafting protocol to 'monitor' Hormuz Strait traffic: IRNA,0.0,Neutral
"Thu, 02 Apr 2026 07:00:00 GMT",Unknown,Iran approves plan to impose tolls on Strait of Hormuz,0.0,Neutral
"Thu, 02 Apr 2026 07:00:00 GMT",Unknown,Iran’s ‘Tollbooth’ Tightens Grip on Hormuz as Ships Offered Safe Passage—For a Price,0.5,Positive
"Thu, 02 Apr 2026 07:00:00 GMT",Unknown,Strait of Hormuz: How are beverage commodities under pressure?,0.0,Neutral
"Thu, 02 Apr 2026 07:00:00 GMT",Unknown,UK-led coalition of 40 countries vows action on Hormuz Strait closure,0.1,Neutral
"Thu, 02 Apr 2026 07:00:00 GMT",Unknown,UK gathering dozens of countries in push to reopen Strait of Hormuz,0.0,Neutral
"Thu, 02 Apr 2026 07:00:00 GMT",Unknown,UK and allies discuss sanctions to stop Iran blocking Strait of Hormuz,0.0,Neutral
"Thu, 02 Apr 2026 07:00:00 GMT",Unknown,Bahrain waters down UN proposal over opposition to allowing force to open Strait of Hormuz,-0.08,Neutral
"Thu, 02 Apr 2026 07:00:00 GMT",Unknown,UK to host talks with 35 countries on reopening Strait of Hormuz,0.0,Neutral
"Thu, 02 Apr 2026 07:00:00 GMT",Unknown,Can Starmer’s 40-nation coalition open the Strait of Hormuz?,0.0,Neutral
"Thu, 02 Apr 2026 07:00:00 GMT",Unknown,Hormuz vs. Bab el-Mandeb: The Yom Kippur Precedent and Closing the Gates of the Sea,0.0,Neutral
"Thu, 02 Apr 2026 07:00:00 GMT",Unknown,Strait of Hormuz closure pushes Asia-US ocean rates up 29%,0.0,Neutral
"Wed, 01 Apr 2026 07:00:00 GMT",Unknown,"Iran war's ""core strategic objectives are nearing completion,"" Trump says",0.0,Neutral
"Thu, 02 Apr 2026 07:00:00 GMT",Unknown,"Trump calls on world to build ‘delayed courage,’ seize key oil route from Iran",0.0,Neutral
"Thu, 02 Apr 2026 07:00:00 GMT",Unknown,"Iran moves to take permanent control of Strait of Hormuz, a vital shipping choke point",0.1,Neutral
"Thu, 02 Apr 2026 07:00:00 GMT",Unknown,Philippines Holds Talks With Iran on Safe Passage Through Strait of Hormuz,0.5,Positive
"Thu, 02 Apr 2026 07:00:00 GMT",Unknown,U.K. Hosts Coalition Talks to Reopen Hormuz—Without the U.S.,-0.12,Neutral
"Thu, 02 Apr 2026 07:00:00 GMT",Unknown,Britain says 40 countries discuss reopening Strait of Hormuz after Iran blockade,0.0,Neutral
"Thu, 02 Apr 2026 07:00:00 GMT",Unknown,Macron says it is unrealistic to open Hormuz Strait by force,-0.25,Negative
"Thu, 02 Apr 2026 07:00:00 GMT",Unknown,First LNG Carrier Among Three Omani Ships Breaking Out Through Hormuz,0.25,Positive
"Thu, 02 Apr 2026 07:00:00 GMT",Unknown,"Kremlin aide Ushakov says Strait of Hormuz is open for Russia, Ifax reports",0.0,Neutral
"Thu, 02 Apr 2026 07:00:00 GMT",Unknown,Why are US gas prices rising if we don't need oil from the Strait of Hormuz?,0.0,Neutral
"Thu, 02 Apr 2026 07:00:00 GMT",Unknown,Strait of Hormuz sees just a handful of ships trickling through as Iran’s chokehold continues,0.14,Neutral
"Thu, 02 Apr 2026 07:00:00 GMT",Unknown,"Iran to allow safe passage of Philippine ships, fuel supply through Strait of Hormuz, says Manila",0.5,Positive
"Thu, 02 Apr 2026 07:00:00 GMT",Unknown,Car carriers stuck in Strait of Hormuz disrupt Chinese car imports to Middle East,0.0,Neutral
"Thu, 02 Apr 2026 07:00:00 GMT",Unknown,Markets rally hard on Iran’s promise to play nice at Hormuz as its leaders pocket billions from the disruption,0.15,Neutral
"Thu, 02 Apr 2026 07:00:00 GMT",Unknown,"European, Gulf nations scramble to solve Strait of Hormuz crisis after Trump says allies should take lead",0.0,Neutral
"Thu, 02 Apr 2026 07:00:00 GMT",Unknown,The Critical Commodities Caught in the Hormuz Blockade,-0.23,Negative
"Thu, 02 Apr 2026 07:00:00 GMT",Unknown,Trump Has to Force Strait of Hormuz Open,0.0,Neutral
"Thu, 02 Apr 2026 07:00:00 GMT",Unknown,The Strait Jacket of Hormuz,0.0,Neutral
"Thu, 02 Apr 2026 07:00:00 GMT",Unknown,Gulf states call for UN approval to use force to secure Hormuz Strait,0.4,Positive
"Thu, 02 Apr 2026 07:00:00 GMT",Unknown,Iran Reportedly Accepts Crypto and Yuan for Strait of Hormuz Shipping Tolls,0.0,Neutral
"Thu, 02 Apr 2026 07:00:00 GMT",Unknown,"As Trump doubles down on Iran war, markets shudder and oil prices climb",-0.16,Neutral
"Thu, 02 Apr 2026 07:00:00 GMT",Unknown,A Bid to Use Force to Open Strait of Hormuz Hits Roadblocks at U.N. Security Council,0.05,Neutral
"Thu, 02 Apr 2026 07:00:00 GMT",Unknown,Iran says Hormuz remains open to world but 'closed to enemies of the Iranian people',-0.05,Neutral
"Thu, 02 Apr 2026 07:00:00 GMT",Unknown,The Black Sea Deal Was a Diplomatic Success. Can It Work in Hormuz?,0.15,Neutral
"Thu, 02 Apr 2026 07:00:00 GMT",Unknown,Video: Trump Says Opening the Strait of Hormuz ‘Should Be Easy.’ Will It?,0.33,Positive
"Fri, 03 Apr 2026 07:00:00 GMT",Unknown,Why the Strait of Hormuz Is More Than an Energy Crisis,0.3,Positive
"Fri, 03 Apr 2026 07:00:00 GMT",Unknown,Shipping Industry Uncertain As Hormuz Crisis Carries On,0.0,Neutral
"Fri, 03 Apr 2026 07:00:00 GMT",Unknown,French container ship first major carrier to exit Strait of Hormuz,0.1,Neutral
"Fri, 03 Apr 2026 07:00:00 GMT",Unknown,"Exclusive: US intelligence warns Iran unlikely to ease Hormuz Strait chokehold soon, sources say",-0.5,Negative
"Fri, 03 Apr 2026 07:00:00 GMT",Unknown,Strait of Hormuz Under Threat of Mines: Are Littoral Combat Ships the Solution?,0.0,Neutral
"Fri, 03 Apr 2026 07:00:00 GMT",Unknown,Meeting on the Strait of Hormuz,-0.06,Neutral
"Fri, 03 Apr 2026 07:00:00 GMT",Unknown,UN Security Council Delays Vote On Plan To Open Strait Of Hormuz Amid Divisions,0.13,Neutral
"Fri, 03 Apr 2026 07:00:00 GMT",Unknown,"Japanese, French and Omani vessels cross the Strait of Hormuz",0.0,Neutral
"Fri, 03 Apr 2026 07:00:00 GMT",Unknown,Competing Strategies Emerge for Opening the Strait of Hormuz,0.0,Neutral
"Fri, 03 Apr 2026 07:00:00 GMT",Unknown,World anxious to open Hormuz Strait while Trump and Iran trade threats,-0.12,Neutral
"Fri, 03 Apr 2026 07:00:00 GMT",Unknown,Trump says US can take Strait of Hormuz with more time,0.5,Positive
"Fri, 03 Apr 2026 07:00:00 GMT",Unknown,Strait of Hormuz Reopens — US Still Blocking Iran Shipping,0.0,Neutral
"Fri, 03 Apr 2026 07:00:00 GMT",Unknown,French-owned ship passes through Strait of Hormuz,0.0,Neutral
"Fri, 03 Apr 2026 07:00:00 GMT",Unknown,A Long Gulf War Can Starve the World. A Hormuz Transit Deal Could Save Millions.,-0.05,Neutral
"Fri, 03 Apr 2026 07:00:00 GMT",Unknown,First Western shipping vessel transits Strait of Hormuz since start of war,0.12,Neutral
"Fri, 03 Apr 2026 07:00:00 GMT",Unknown,Trump: ‘With a little more time’ the US ‘can easily’ reopen Strait of Hormuz,0.25,Positive
"Fri, 03 Apr 2026 07:00:00 GMT",Unknown,"Ending the war on Iran is the only way to open Strait of Hormuz, says China",0.0,Neutral
"Fri, 03 Apr 2026 07:00:00 GMT",Unknown,"Strait of Hormuz Remains Open for Russian Ships, Kremlin Aide Says",0.0,Neutral
"Fri, 03 Apr 2026 07:00:00 GMT",Unknown,"French-owned CMA CGM container ship passes Strait of Hormuz, data shows",0.0,Neutral
"Fri, 03 Apr 2026 07:00:00 GMT",Unknown,Trump’s Mission Impossible for Allies: Reopening the Strait of Hormuz,-0.67,Negative
"Fri, 03 Apr 2026 07:00:00 GMT",Unknown,Global Disruption at the Strait of Hormuz,0.0,Neutral
"Fri, 03 Apr 2026 07:00:00 GMT",Unknown,"Iran ‘toll booth’ on Strait of Hormuz underscores its leverage on Trump, US",0.0,Neutral
"Fri, 03 Apr 2026 07:00:00 GMT",Unknown,Trump and the Myth of American Oil Independence,0.0,Neutral
"Fri, 03 Apr 2026 07:00:00 GMT",Unknown,How the Iran war could shift energy policies around the world,0.0,Neutral
"Fri, 03 Apr 2026 07:00:00 GMT",Unknown,"Japan LNG tanker passes through Strait of Hormuz, 1st since Iran war begins",0.0,Neutral
"Fri, 03 Apr 2026 07:00:00 GMT",Unknown,"Omani, French and Japanese vessels transit the Strait of Hormuz",0.0,Neutral
"Fri, 03 Apr 2026 07:00:00 GMT",Unknown,Iran Cashes In On Strait Of Hormuz With Tolls As Trump Declares America 'Totally Independent' Of Middle East Oil,0.0,Neutral
"Fri, 03 Apr 2026 07:00:00 GMT",Unknown,"China, Europe and why Beijing took a swing at Iran over the Strait of Hormuz",0.0,Neutral
"Fri, 03 Apr 2026 07:00:00 GMT",Unknown,Hormuz and the Export of Chaos into Global Supply Chains,0.0,Neutral
"Fri, 03 Apr 2026 07:00:00 GMT",Unknown,First LNG carrier transits Strait of Hormuz since Iran war began,0.25,Positive
"Fri, 03 Apr 2026 07:00:00 GMT",Unknown,Will force be used to reopen Strait of Hormuz?,0.0,Neutral
"Fri, 03 Apr 2026 07:00:00 GMT",Unknown,Hormuz and the Slow-Burn Fertilizer Supply Shock,0.0,Neutral
"Fri, 03 Apr 2026 07:00:00 GMT",Unknown,"French, Japanese ships cross Strait of Hormuz in first since war",0.06,Neutral
"Fri, 03 Apr 2026 07:00:00 GMT",Unknown,"More ships pass through Strait of Hormuz, but traffic remains far below normal",0.25,Positive
"Fri, 03 Apr 2026 07:00:00 GMT",Unknown,"Iran Imposes New ‘Cash, Grass, Or Ass’ Fee For Strait Of Hormuz",0.14,Neutral
"Fri, 03 Apr 2026 07:00:00 GMT",Unknown,"Several vessels, including French container ship, pass through strait of Hormuz",0.0,Neutral
"Fri, 03 Apr 2026 07:00:00 GMT",Unknown,States grapple with Iranian stranglehold over Hormuz Strait as oil prices soar,0.0,Neutral
"Thu, 02 Apr 2026 07:00:00 GMT",Unknown,"UK accuses Iran of Hormuz ‘hijack,’ holding global economy hostage",0.0,Neutral
"Fri, 03 Apr 2026 07:00:00 GMT",Unknown,"Exclusive-US intelligence warns Iran unlikely to ease Hormuz Strait chokehold soon, sources say",-0.5,Negative
"Thu, 02 Apr 2026 07:00:00 GMT",Unknown,"35 countries meet on Strait of Hormuz, focused on reopening oil route",0.2,Neutral
"Fri, 03 Apr 2026 07:00:00 GMT",Unknown,"Trump Says U.S. Could ‘Take The Oil’ From Strait Of Hormuz, ‘With A Little More Time’",0.16,Neutral
"Fri, 03 Apr 2026 07:00:00 GMT",Unknown,CMA CGM Vessel Is First Major Carrier Vessel Through Strait of Hormuz,0.16,Neutral
"Thu, 02 Apr 2026 07:00:00 GMT",Unknown,“Fragmented responses are no longer sufficient”: IMO Secretary-General,0.0,Neutral
"Thu, 02 Apr 2026 07:00:00 GMT",Unknown,Yuan Fees for Ships to Pass Hormuz Boost Chinese Payment Stocks,0.0,Neutral
"Thu, 02 Apr 2026 07:00:00 GMT",Unknown,EU backs European-led coalition to reopen the Strait of Hormuz,0.0,Neutral
