Date,Source,Headline,Sentiment_Score,Sentiment_Label
"Tue, 16 Jun 2026 07:00:00 GMT",Unknown,"Strait of Hormuz flow will take ‘weeks’ to resume, warns shipping boss",0.0,Neutral
"Thu, 18 Jun 2026 07:00:00 GMT",Unknown,"Stranded ships have begun transiting the Strait of Hormuz, maritime data company says",0.0,Neutral
"Thu, 18 Jun 2026 07:00:00 GMT",Unknown,Three Saudi oil tankers carrying 6 million barrels cross Strait of Hormuz,0.0,Neutral
"Thu, 18 Jun 2026 07:00:00 GMT",Unknown,Gulf exporters' quest to bypass Hormuz will reshape the region,0.0,Neutral
"Thu, 18 Jun 2026 07:00:00 GMT",Unknown,U.S. lifts blockade on Iranian ports as 60-day clock for a final deal starts ticking,0.0,Neutral
"Thu, 18 Jun 2026 07:00:00 GMT",Unknown,"The Strait of Hormuz is reopening, but global shipping won’t return to normal for months",0.07,Neutral
"Thu, 18 Jun 2026 07:00:00 GMT",Unknown,Iran wants to charge ‘fees’ on Hormuz passage. What impacts could that have?,0.2,Neutral
"Thu, 18 Jun 2026 07:00:00 GMT",Unknown,White House defends Iran agreement as U.S. lifts Strait of Hormuz blockade,0.0,Neutral
"Thu, 18 Jun 2026 07:00:00 GMT",Unknown,Is the Strait of Hormuz now open?,0.0,Neutral
"Thu, 18 Jun 2026 07:00:00 GMT",Unknown,Iran announces plans to bring in maritime fees for strait of Hormuz,0.0,Neutral
"Thu, 18 Jun 2026 07:00:00 GMT",Unknown,"Germany moves two ships to Djibouti, eyeing multinational Hormuz mission this summer",0.0,Neutral
"Thu, 18 Jun 2026 07:00:00 GMT",Unknown,The Oil Market Canceled The Hormuz Crisis Before The Ceasefire,0.0,Neutral
"Thu, 18 Jun 2026 07:00:00 GMT",Unknown,"Three Saudi-flagged supertankers sail through Hormuz after Iran deal signed, data shows",0.0,Neutral
"Thu, 18 Jun 2026 07:00:00 GMT",Unknown,Strait of Hormuz reopening may take weeks to ease shipping backlog and oil pressure,0.0,Neutral
"Thu, 18 Jun 2026 07:00:00 GMT",Unknown,"Hormuz reopening to release wave of oil supply, depress prices",-0.07,Neutral
"Thu, 18 Jun 2026 07:00:00 GMT",Unknown,Why the oil may start flowing through the Strait of Hormuz faster than many believe,0.5,Positive
"Thu, 18 Jun 2026 07:00:00 GMT",Unknown,US military lifts Navy blockade in Strait of Hormuz after two months,-0.1,Neutral
"Thu, 18 Jun 2026 07:00:00 GMT",Unknown,Strait of Hormuz Reopening Brings Relief for Global Economy,0.0,Neutral
"Thu, 18 Jun 2026 07:00:00 GMT",Unknown,Will Passage Fees be Charged in the Strait of Hormuz?,0.0,Neutral
"Thu, 18 Jun 2026 07:00:00 GMT",Unknown,"Tracking traffic in the Strait of Hormuz, in maps and charts",0.0,Neutral
"Thu, 18 Jun 2026 07:00:00 GMT",Unknown,"Germany deploys ships to Red Sea for possible Hormuz mission, minister says",0.0,Neutral
"Thu, 18 Jun 2026 07:00:00 GMT",Unknown,Strait of Hormuz reopening gradually as 12 tankers transit after US-Iran framework deal,0.0,Neutral
"Thu, 18 Jun 2026 07:00:00 GMT",Unknown,"What the Trump-Iran agreement says about Lebanon, Hormuz and uranium",0.0,Neutral
"Thu, 18 Jun 2026 07:00:00 GMT",Unknown,3 supertankers sail through Strait of Hormuz after deal signed: Report,0.0,Neutral
"Thu, 18 Jun 2026 07:00:00 GMT",Unknown,Even Hormuz reopening will not resolve Europe’s key energy vulnerability,0.0,Neutral
"Thu, 18 Jun 2026 07:00:00 GMT",Unknown,"US Ends Hormuz Blockade, Downplays Tolls as Negotiations Restart",0.0,Neutral
"Thu, 18 Jun 2026 07:00:00 GMT",Unknown,U.S. lifts naval blockade of the Strait of Hormuz and Iranian ports,0.0,Neutral
"Thu, 18 Jun 2026 07:00:00 GMT",Unknown,"US and Iran sign initial deal to end war, ease sanctions and open strait as nuclear talks continue",0.0,Neutral
"Thu, 18 Jun 2026 07:00:00 GMT",Unknown,Strait of Hormuz updates: Traffic shows 'recovery' a day after US and Iran signed a 14-point agreement,0.0,Neutral
"Thu, 18 Jun 2026 07:00:00 GMT",Unknown,German military prepares for possible mine-clearing mission,-0.03,Neutral
"Thu, 18 Jun 2026 07:00:00 GMT",Unknown,"Trump and Iran’s president sign initial deal to end war, open Strait of Hormuz and ease sanctions",0.0,Neutral
"Thu, 18 Jun 2026 07:00:00 GMT",Unknown,"World reacts to US-Iran deal to extend ceasefire, reopen Strait of Hormuz",0.0,Neutral
"Thu, 18 Jun 2026 07:00:00 GMT",Unknown,1st French LNG tanker crosses Strait of Hormuz since Iran–US war began,0.0,Neutral
"Thu, 18 Jun 2026 07:00:00 GMT",Unknown,"Shipping groups want mines cleared, TSS restored for normal Hormuz traffic",0.1,Neutral
"Thu, 18 Jun 2026 07:00:00 GMT",Unknown,2 key details about the Strait of Hormuz in the agreement Trump and Iran just signed,0.0,Neutral
"Thu, 18 Jun 2026 07:00:00 GMT",Unknown,OPEC chief dismisses IEA supply glut forecast as 'critical' Strait of Hormuz reopens,0.0,Neutral
"Thu, 18 Jun 2026 07:00:00 GMT",Unknown,Views of Strait of Hormuz after Iran and U.S. deal signed,0.0,Neutral
"Thu, 18 Jun 2026 07:00:00 GMT",Unknown,"Analysis: Iran Deal Provides Economic Boost, But Hormuz Shipping Is Key",0.16,Neutral
"Thu, 18 Jun 2026 07:00:00 GMT",Unknown,Vance slams Israeli reaction to Iran deal as U.S. military lifts blockade,-0.1,Neutral
"Thu, 18 Jun 2026 07:00:00 GMT",Unknown,"US ends Iran blockade, Hormuz threat level reduced further",0.0,Neutral
"Thu, 18 Jun 2026 07:00:00 GMT",Unknown,US military says it has lifted naval blockade of Iranian ports,-0.1,Neutral
"Thu, 18 Jun 2026 07:00:00 GMT",Unknown,"US-Iran deal takeaways: reopening the strait of Hormuz, waived oil sanctions and Lebanon",0.0,Neutral
"Thu, 18 Jun 2026 07:00:00 GMT",Unknown,"Oil flows through Hormuz will take time to recover, banks say",0.0,Neutral
"Thu, 18 Jun 2026 07:00:00 GMT",Unknown,The Iran Deal Is Hazy on Hormuz,-0.12,Neutral
"Thu, 18 Jun 2026 07:00:00 GMT",Unknown,Strait of Hormuz: Iran will charge fees even after deal,0.0,Neutral
"Thu, 18 Jun 2026 07:00:00 GMT",Unknown,Shipping Costs Soar as Hormuz Crisis Reshapes Global Trade,-0.23,Negative
"Thu, 18 Jun 2026 07:00:00 GMT",Unknown,"BOE Leaves Rates Unchanged, Signals Caution on Hormuz Opening",0.0,Neutral
"Thu, 18 Jun 2026 07:00:00 GMT",Unknown,More than 12.5M barrels of oil passed through Strait of Hormuz after deal signed: Vance,0.5,Positive
"Wed, 17 Jun 2026 07:00:00 GMT",Unknown,Why Hormuz reopening hands South Korea a diplomatic problem at G7 summit,0.0,Neutral
"Thu, 18 Jun 2026 07:00:00 GMT",Unknown,US-Iran Deal Leaves Europe on the Sidelines in Hormuz,0.0,Neutral
"Thu, 18 Jun 2026 07:00:00 GMT",Unknown,"Trump, Pezeshkian sign deal to end Iran war, reopen Hormuz",0.0,Neutral
"Thu, 18 Jun 2026 07:00:00 GMT",Unknown,Maritime Industry Demands Clarity on Hormuz Reopening as Mine Risks Persist,0.0,Neutral
"Thu, 18 Jun 2026 07:00:00 GMT",Unknown,"Strait of Hormuz may be “open,” but mines are still a danger",0.0,Neutral
"Thu, 18 Jun 2026 07:00:00 GMT",Unknown,Oil Prices Fall as U.S.-Iran Deal to Reopen Hormuz Takes Effect,0.14,Neutral
"Thu, 18 Jun 2026 07:00:00 GMT",Unknown,Can the US-Iran deal survive a defiant Israel and Hormuz uncertainties?,0.0,Neutral
"Thu, 18 Jun 2026 07:00:00 GMT",Unknown,Iran Deal Raises Serious Questions Over Future Management of the Strait of Hormuz,-0.17,Neutral
"Thu, 18 Jun 2026 07:00:00 GMT",Unknown,"Jake Sullivan and Jon Finer on the US-Iran Deal, Hormuz Realities, and Iran’s Nuclear Future",0.0,Neutral
"Thu, 18 Jun 2026 07:00:00 GMT",Unknown,"US-Iran accord opens way for Hormuz charges, industry warns",0.0,Neutral
"Thu, 18 Jun 2026 07:00:00 GMT",Unknown,Strait of Hormuz Starts to Reopen,0.0,Neutral
"Thu, 18 Jun 2026 07:00:00 GMT",Unknown,U.S. Officially Ends Maritime Blockade of Iran and Declares Hormuz Open,0.0,Neutral
"Thu, 18 Jun 2026 07:00:00 GMT",Unknown,Timelapse recording shows traffic increase in Strait of Hormuz,0.0,Neutral
"Thu, 18 Jun 2026 07:00:00 GMT",Unknown,First Saudi Supertankers Start Crossing Hormuz After Deal,0.25,Positive
"Thu, 18 Jun 2026 07:00:00 GMT",Unknown,"Khamenei shifts responsibility for MoU as Iran, US implement Hormuz terms",0.0,Neutral
"Thu, 18 Jun 2026 07:00:00 GMT",Unknown,French tanker crosses Strait of Hormuz days after US-Iran deal,0.0,Neutral
"Thu, 18 Jun 2026 07:00:00 GMT",Unknown,"U.S. military lifts naval blockade in Strait of Hormuz, Gulf of Oman",-0.1,Neutral
"Thu, 18 Jun 2026 07:00:00 GMT",Unknown,"Watch US Ends Hormuz Blockade, Downplays Tolls as 60-Day Clock Starts",0.0,Neutral
"Thu, 18 Jun 2026 07:00:00 GMT",Unknown,Supertankers With 80 Million Barrels of Oil Ready to Pass Hormuz,0.2,Neutral
"Thu, 18 Jun 2026 07:00:00 GMT",Unknown,U.S. Ends Hormuz Blockade as Negotiations Restart,0.0,Neutral
"Wed, 17 Jun 2026 07:00:00 GMT",Unknown,UAE aims to cut dependency on Strait of Hormuz to 'zero' with major ports expansion plan,0.06,Neutral
"Thu, 18 Jun 2026 07:00:00 GMT",Unknown,How Long Will It Take The World To Recalibrate After Hormuz Reopens?,0.1,Neutral
"Thu, 18 Jun 2026 07:00:00 GMT",Unknown,All eyes on the Strait of Hormuz after Iran and US agree to 60-day ceasefire,0.2,Neutral
"Thu, 18 Jun 2026 07:00:00 GMT",Unknown,Oil Is Flowing Through Hormuz After Interim US-Iran Peace Deal,0.0,Neutral
"Thu, 18 Jun 2026 07:00:00 GMT",Unknown,UAE works to reduce reliance on Strait of Hormuz with new pipelines,0.14,Neutral
"Thu, 18 Jun 2026 07:00:00 GMT",Unknown,Japan leaves open SDF deployment to Strait of Hormuz,0.0,Neutral
"Thu, 18 Jun 2026 07:00:00 GMT",Unknown,"US forces lift naval blockade of Iranian ports in Hormuz, CENTCOM says",0.0,Neutral
"Thu, 18 Jun 2026 07:00:00 GMT",Unknown,Energy Agency Director Casts Doubt on the Security of Strait of Hormuz,0.0,Neutral
"Thu, 18 Jun 2026 07:00:00 GMT",Unknown,Iran's Strait Authority to Facilitate Passage Through Hormuz,0.0,Neutral
"Thu, 18 Jun 2026 07:00:00 GMT",Unknown,The Strait of Hormuz Is Reopening,0.0,Neutral
"Wed, 17 Jun 2026 07:00:00 GMT",Unknown,Goldman Says Hormuz Oil Flows May Recover to Only 70% After War,0.0,Neutral
"Fri, 19 Jun 2026 07:00:00 GMT",Unknown,Stranded Ships Hoping for Escape Find a Turbulent Strait of Hormuz,0.14,Neutral
"Fri, 19 Jun 2026 07:00:00 GMT",Unknown,Strait of Hormuz feels tense and uncertain as peace deal takes hold,-0.33,Negative
"Fri, 19 Jun 2026 07:00:00 GMT",Unknown,"Strait of Hormuz ship transits – two routes, two sets of rules",0.0,Neutral
"Fri, 19 Jun 2026 07:00:00 GMT",Unknown,Hormuz disruption will continue until 80 mines blocking route are cleared,0.0,Neutral
"Fri, 19 Jun 2026 07:00:00 GMT",Unknown,Tehran says Strait of Hormuz remains open after confusion,0.0,Neutral
"Fri, 19 Jun 2026 07:00:00 GMT",Unknown,Iran says it will waive fees for Hormuz during 60 day negotiation period,0.0,Neutral
"Fri, 19 Jun 2026 07:00:00 GMT",Unknown,Opinion | Iran Just Taught the World a Dangerous Lesson,-0.35,Negative
"Fri, 19 Jun 2026 07:00:00 GMT",Unknown,Oil tanker traffic in Strait of Hormuz jumps after U.S. and Iran implement deal to open sea lane,0.0,Neutral
"Fri, 19 Jun 2026 07:00:00 GMT",Unknown,Video: Demining the Strait of Hormuz,0.14,Neutral
"Fri, 19 Jun 2026 07:00:00 GMT",Unknown,Oil shipments rise in Hormuz although questions grow over Iran's transit terms,0.0,Neutral
"Fri, 19 Jun 2026 07:00:00 GMT",Unknown,The Secret Life of the Strait of Hormuz,-0.4,Negative
"Fri, 19 Jun 2026 07:00:00 GMT",Unknown,An Open Strait of Hormuz Won’t Fix Gas Prices Overnight,0.0,Neutral
"Fri, 19 Jun 2026 07:00:00 GMT",Unknown,"Hormuz relief may not ease the economic toll that's already 'baked in,' analysts warn",0.2,Neutral
"Fri, 19 Jun 2026 07:00:00 GMT",Unknown,Iran waives Strait of Hormuz fees during 60-day peace negotiation period,0.0,Neutral
"Fri, 19 Jun 2026 07:00:00 GMT",Unknown,Oil prices rise as Lebanon fighting erupts and Hormuz traffic still slow,-0.3,Negative
"Fri, 19 Jun 2026 07:00:00 GMT",Unknown,Iran's insurance gambit in the Strait of Hormuz is a claim waiting to happen,0.0,Neutral
"Fri, 19 Jun 2026 07:00:00 GMT",Unknown,Hormuz Reopening Shifts Focus to Gulf Oil Storage and Shipping,0.0,Neutral
"Fri, 19 Jun 2026 07:00:00 GMT",Unknown,JMIC Warns of Confirmed Mine in Hormuz as Uncertainties Continue,0.4,Positive
"Fri, 19 Jun 2026 07:00:00 GMT",Unknown,Stranded ships begin to cross Hormuz after initial U.S.-Iran deal,0.0,Neutral
"Fri, 19 Jun 2026 07:00:00 GMT",Unknown,Abu Dhabi Tells Buyers to Load Oil Shipments From Inside Hormuz,0.0,Neutral
"Fri, 19 Jun 2026 07:00:00 GMT",Unknown,Texas-Based Autonomous Surface Vessel Helped Rescue Helicopter Pilots in Strait of Hormuz,0.4,Positive
"Fri, 19 Jun 2026 07:00:00 GMT",Unknown,Video. Timelapse video shows ships moving through the Strait of Hormuz since reopening,0.0,Neutral
"Fri, 19 Jun 2026 07:00:00 GMT",Unknown,Trump says US quietly moved 87 oil tankers through Strait of Hormuz,0.0,Neutral
"Fri, 19 Jun 2026 07:00:00 GMT",Unknown,Hormuz Deal Brings Cautious Relief To Pharma Packaging Supply Chains,0.0,Neutral
"Fri, 19 Jun 2026 07:00:00 GMT",Unknown,Iran announces new procedures for vessels seeking to transit Strait of Hormuz,0.14,Neutral
"Fri, 19 Jun 2026 07:00:00 GMT",Unknown,Why Germany's navy could be crucial for the Strait of Hormuz,0.0,Neutral
"Fri, 19 Jun 2026 07:00:00 GMT",Unknown,Mine spotted in Strait of Hormuz as ship traffic climbs,0.0,Neutral
"Fri, 19 Jun 2026 07:00:00 GMT",Unknown,Iran to seek ‘insurance fees’ for passage through Strait of Hormuz,0.0,Neutral
"Fri, 19 Jun 2026 07:00:00 GMT",Unknown,80 Million Barrels of Crude Are Lined Up to Exit the Strait of Hormuz,-0.7,Negative
"Fri, 19 Jun 2026 07:00:00 GMT",Unknown,"Hormuz traffic reaches highest level since mid-April, maritime data shows",0.0,Neutral
"Fri, 19 Jun 2026 07:00:00 GMT",Unknown,"Iran shuts down the Strait of Hormuz just days after signing a US ceasefire deal, citing Israel's Lebanon presence",-0.16,Neutral
"Fri, 19 Jun 2026 07:00:00 GMT",Unknown,Iran’s New ‘Toll by Insurance’ Raises Stakes in Strait of Hormuz,0.14,Neutral
"Fri, 19 Jun 2026 07:00:00 GMT",Unknown,Insurers Roll Out $400 Million War-Risk Facility for Hormuz Shipping,-0.7,Negative
"Fri, 19 Jun 2026 07:00:00 GMT",Unknown,Lloyd’s unveils Chubb-led war risk insurance facility for vessels in Strait of Hormuz,0.0,Neutral
"Fri, 19 Jun 2026 07:00:00 GMT",Unknown,"Vessels passing through Strait of Hormuz after Israel, Hezbollah agree to ceasefire in Lebanon",0.0,Neutral
"Fri, 19 Jun 2026 07:00:00 GMT",Unknown,India Receives First Post-Deal LNG Cargo Through Strait Of Hormuz,-0.07,Neutral
"Fri, 19 Jun 2026 07:00:00 GMT",Unknown,Barnacle bill: Hull-cleaning costs jump for ships trapped by Strait of Hormuz closure,-0.2,Neutral
"Fri, 19 Jun 2026 07:00:00 GMT",Unknown,Iran plans to charge insurance fees to vessels in Hormuz after US deal expires,0.0,Neutral
"Fri, 19 Jun 2026 07:00:00 GMT",Unknown,"Pakistan Reports Mine in Strait of Hormuz Area, Warns Ships",0.0,Neutral
"Fri, 19 Jun 2026 07:00:00 GMT",Unknown,Trump declares Iran is 'FINISHED' amid reports Strait of Hormuz is closed again,-0.1,Neutral
"Fri, 19 Jun 2026 07:00:00 GMT",Unknown,Strait of Hormuz Traffic Thins Friday as Shipowners Err on Side of Safety,0.0,Neutral
"Fri, 19 Jun 2026 07:00:00 GMT",Unknown,Iran Foreign Ministry says Strait of Hormuz is open after IRGC warned it was closed — sparking confusion,-0.04,Neutral
"Fri, 19 Jun 2026 07:00:00 GMT",Unknown,"Japan-owned vessel passed through Strait of Hormuz on Friday, Japan says",0.0,Neutral
"Fri, 19 Jun 2026 07:00:00 GMT",Unknown,Pakistan warns ships after mine reported in Strait of Hormuz,0.0,Neutral
"Fri, 19 Jun 2026 07:00:00 GMT",Unknown,"The New York Times. . Mines in the Strait of Hormuz may outlast the U.S.-Israeli war in Iran. Our reporter, John Ismay, who served as a Navy explosive ordnance disposal officer and deep-sea diver for eight years, explains why.",0.14,Neutral
"Fri, 19 Jun 2026 07:00:00 GMT",Unknown,"Hormuz ship crossings spike after U.S.-Iran deal to end war, says marine tracker",0.0,Neutral
"Fri, 19 Jun 2026 07:00:00 GMT",Unknown,Iran claims the Strait of Hormuz is closed again. Few ships were leaving in the first place,-0.01,Neutral
"Fri, 19 Jun 2026 07:00:00 GMT",Unknown,"Abu Dhabi tells buyers to load oil shipments from inside Hormuz, Bloomberg News reports",0.0,Neutral
"Fri, 19 Jun 2026 07:00:00 GMT",Unknown,Hormuz Traffic Stalls as U.S.-Iran Talks Collapse,-0.7,Negative
"Fri, 19 Jun 2026 07:00:00 GMT",Unknown,"Navy lifts blockade, will keep ships around the Strait of Hormuz",0.0,Neutral
"Fri, 19 Jun 2026 07:00:00 GMT",Unknown,"Hormuz transits hit 2-month high, Iran issues passage application",0.16,Neutral
"Fri, 19 Jun 2026 07:00:00 GMT",Unknown,Shipowners hope Strait of Hormuz will reopen soon,0.0,Neutral
"Fri, 19 Jun 2026 07:00:00 GMT",Unknown,Windward: 18 Hormuz transits recorded across June 17 to 18,0.0,Neutral
"Fri, 19 Jun 2026 07:00:00 GMT",Unknown,US forces end blockade of Iranian shipping in Strait of Hormuz,0.0,Neutral
"Fri, 19 Jun 2026 07:00:00 GMT",Unknown,"With Strait of Hormuz held hostage, Trump’s Iran deal is worse than Obama’s",-0.22,Negative
"Fri, 19 Jun 2026 07:00:00 GMT",Unknown,The Latest Status of the Strait of Hormuz Under Iranian Management,0.5,Positive
"Fri, 19 Jun 2026 07:00:00 GMT",Unknown,Oil prices fall as Strait of Hormuz shipments resume,0.0,Neutral
"Fri, 19 Jun 2026 07:00:00 GMT",Unknown,Iran Floats ‘Insurance Fees’ and Asserts Control Over Hormuz,0.0,Neutral
"Fri, 19 Jun 2026 07:00:00 GMT",Unknown,Iran says it plans to impose tolls on Hormuz after 60-day fee-free period,0.0,Neutral
"Fri, 19 Jun 2026 07:00:00 GMT",Unknown,Container shipping faces 3-month recovery as Strait of Hormuz set to reopen,0.0,Neutral
"Fri, 19 Jun 2026 07:00:00 GMT",Unknown,"Iraq to export crude, naphtha through Syria after Hormuz shock",-0.7,Negative
"Fri, 19 Jun 2026 07:00:00 GMT",Unknown,Fertilizer Flow Expected To Rebuild Slowly After Strait of Hormuz Opens,-0.2,Neutral
"Fri, 19 Jun 2026 07:00:00 GMT",Unknown,Frontlines with Robert Sherman: Strait of Hormuz feels tense and uncertain,-0.33,Negative
"Sat, 20 Jun 2026 07:00:00 GMT",Unknown,Commercial Vessels Flow Through Open Strait of Hormuz,0.0,Neutral
"Sat, 20 Jun 2026 07:00:00 GMT",Unknown,U.S. and Iran begin peace talks amid conflicting claims over Strait of Hormuz,0.0,Neutral
"Sat, 20 Jun 2026 07:00:00 GMT",Unknown,New Strait of Hormuz Closure Announcement Threatens the Slow Uptick in Traffic,-0.04,Neutral
"Sat, 20 Jun 2026 07:00:00 GMT",Unknown,"Iran announces plans to close the Strait of Hormuz, alleging ‘violations of the ceasefire’",0.0,Neutral
"Sat, 20 Jun 2026 07:00:00 GMT",Unknown,Iran says it is closing Strait of Hormuz over Israeli attacks on Lebanon,0.0,Neutral
"Sat, 20 Jun 2026 07:00:00 GMT",Unknown,US and Iran to talk Sunday in Switzerland as Tehran says it closed Strait of Hormuz again,-0.1,Neutral
"Sat, 20 Jun 2026 07:00:00 GMT",Unknown,"Shipping companies will decide when the Strait of Hormuz is open, and the latest deal sows confusion",0.25,Positive
"Sat, 20 Jun 2026 07:00:00 GMT",Unknown,Iran declares the Strait of Hormuz closed,-0.1,Neutral
"Sat, 20 Jun 2026 07:00:00 GMT",Unknown,US forces monitoring Strait of Hormuz to ensure it stays open,0.0,Neutral
"Sat, 20 Jun 2026 07:00:00 GMT",Unknown,"Iran says it is closing Strait of Hormuz, testing fragile agreement with U.S.",0.0,Neutral
"Sat, 20 Jun 2026 07:00:00 GMT",Unknown,Iran claims the Strait of Hormuz is closed again. Few ships were leaving in the first place | CNN Business,-0.02,Neutral
"Sat, 20 Jun 2026 07:00:00 GMT",Unknown,"Iran says it’s closing Strait of Hormuz, citing Israeli strikes on Lebanon",0.0,Neutral
"Sat, 20 Jun 2026 07:00:00 GMT",Unknown,Vance touts ‘record-breaking’ oil flow in Strait of Hormuz as Iran announces closure,0.0,Neutral
"Sat, 20 Jun 2026 07:00:00 GMT",Unknown,Vance lands in Switzerland as Iran says Strait of Hormuz is closed over ceasefire violations,-0.1,Neutral
"Sat, 20 Jun 2026 07:00:00 GMT",Unknown,Iran Says Strait Of Hormuz Is Closed After Lebanon Attacks—U.S. Denies It's Shut,-0.1,Neutral
"Sat, 20 Jun 2026 07:00:00 GMT",Unknown,"Trump vows Iran will not charge Strait of Hormuz tolls, but says US might",0.0,Neutral
"Sat, 20 Jun 2026 07:00:00 GMT",Unknown,Trump says no toll on Strait of Hormuz unless US imposes one,0.0,Neutral
"Sat, 20 Jun 2026 07:00:00 GMT",Unknown,US-Iran talks begin in Switzerland as Tehran says it closed Strait of Hormuz,-0.1,Neutral
"Sat, 20 Jun 2026 07:00:00 GMT",Unknown,US disputes Iranian claims about closing Strait of Hormuz as negotiators head to Switzerland,0.0,Neutral
"Sat, 20 Jun 2026 07:00:00 GMT",Unknown,"US-Iran negotiations end for the day, continue tomorrow in Switzerland",0.0,Neutral
"Sat, 20 Jun 2026 07:00:00 GMT",Unknown,Video: U.S. and Iran Offer Contradictory Statements on Strait of Hormuz,0.14,Neutral
"Sat, 20 Jun 2026 07:00:00 GMT",Unknown,"Trump threatens to charge US tolls in the Strait of Hormuz, if a final deal with Iran isn't reached in 60 days",0.0,Neutral
"Sat, 20 Jun 2026 07:00:00 GMT",Unknown,"Iran says Strait of Hormuz is closed, citing Israeli attacks in Lebanon",-0.1,Neutral
"Sat, 20 Jun 2026 07:00:00 GMT",Unknown,Iran says closed Strait of Hormuz as US deal hits obstacle ahead of Swiss talks,-0.1,Neutral
"Sat, 20 Jun 2026 07:00:00 GMT",Unknown,Trump says US will begin charging tolls in Strait of Hormuz if final Iran deal not reached in 60 days,0.0,Neutral
"Sat, 20 Jun 2026 07:00:00 GMT",Unknown,Iran says Strait of Hormuz shut as U.S.-Iran talks set for Sunday in Switzerland,0.0,Neutral
"Sat, 20 Jun 2026 07:00:00 GMT",Unknown,"Iran closes Strait of Hormuz over ceasefire violations, state media reports",0.0,Neutral
"Sat, 20 Jun 2026 07:00:00 GMT",Unknown,"Iran 'does not control' Strait of Hormuz, flow continues: CENTCOM",0.0,Neutral
"Sat, 20 Jun 2026 07:00:00 GMT",Unknown,Iran says Strait of Hormuz closed again after Israel strikes Lebanon,-0.1,Neutral
"Sat, 20 Jun 2026 07:00:00 GMT",Unknown,Iran floats insurance fees and asserts control over Hormuz,0.0,Neutral
"Sat, 20 Jun 2026 07:00:00 GMT",Unknown,"Iran closes Strait of Hormuz, blames US for breaching deal",0.0,Neutral
"Sat, 20 Jun 2026 07:00:00 GMT",Unknown,Shipping remains far below prewar levels in the Strait of Hormuz.,0.11,Neutral
"Sat, 20 Jun 2026 07:00:00 GMT",Unknown,"Three Indian-flagged oil tankers clear Strait of Hormuz, minister says",0.1,Neutral
"Sat, 20 Jun 2026 07:00:00 GMT",Unknown,Oil Prices to Face Renewed Pressures After Iran Says It Closed the Strait of Hormuz,-0.1,Neutral
"Sat, 20 Jun 2026 07:00:00 GMT",Unknown,Iran shuts Strait of Hormuz as Israel tests MOU with Lebanon strikes,0.0,Neutral
"Sat, 20 Jun 2026 07:00:00 GMT",Unknown,Iran says it's closing Strait of Hormuz again,0.0,Neutral
"Sat, 20 Jun 2026 07:00:00 GMT",Unknown,A Look at the Text of the Agreement Between the United States and Iran,0.14,Neutral
"Sat, 20 Jun 2026 07:00:00 GMT",Unknown,"Vance Heads to Peace Talks, After Iran Says It Closed Strait of Hormuz",-0.1,Neutral
"Sat, 20 Jun 2026 07:00:00 GMT",Unknown,Iran claims Hormuz closed again as IDF attacks Hezbollah; Vance says Switzerland talks may start Sunday,-0.1,Neutral
"Sat, 20 Jun 2026 07:00:00 GMT",Unknown,Trump warns of Hormuz tolls as ships pass despite Iran's closure claim,0.0,Neutral
"Sat, 20 Jun 2026 07:00:00 GMT",Unknown,The New York Times. . Shipping in the Strait of Hormuz faced new disruption on Saturday after Iran’s military said it was closing the waterway. The U.S. military offered a conflicting assessment. https://nyti.ms/4gDjtEu,0.02,Neutral
"Sat, 20 Jun 2026 07:00:00 GMT",Unknown,"Iran claims Strait of Hormuz is closed again, while US says it remains open",-0.05,Neutral
"Sat, 20 Jun 2026 07:00:00 GMT",Unknown,"Trump says no Strait of Hormuz tolls for 60 days during ceasefire, hints at future charges",0.0,Neutral
"Sat, 20 Jun 2026 07:00:00 GMT",Unknown,"Iran, citing 'clear breach' by US, again closed Strait of Hormuz",0.0,Neutral
"Sat, 20 Jun 2026 07:00:00 GMT",Unknown,Iran says it is closing strait of Hormuz over Israeli strikes in Lebanon,0.0,Neutral
"Sat, 20 Jun 2026 07:00:00 GMT",Unknown,"Iran has closed the Strait of Hormuz due to Israel’s ongoing attacks | News, Sports, Jobs",-0.11,Neutral
"Sat, 20 Jun 2026 07:00:00 GMT",Unknown,Video Dispute over Strait of Hormuz ahead of talks,0.5,Positive
"Sat, 20 Jun 2026 07:00:00 GMT",Unknown,Overplaying Strait of Hormuz card will turn Iran into a pariah state,0.0,Neutral
"Sat, 20 Jun 2026 07:00:00 GMT",Unknown,Iran says it has closed Strait of Hormuz again as talks continue,-0.1,Neutral
"Sat, 20 Jun 2026 07:00:00 GMT",Unknown,"Strait of Hormuz ‘closed to all vessels’ over Israeli, US violations: Iran’s IRGC",-0.1,Neutral
"Sat, 20 Jun 2026 07:00:00 GMT",Unknown,Iran Says Hormuz Closed Again as Talks With US Set to Open,-0.05,Neutral
"Sat, 20 Jun 2026 07:00:00 GMT",Unknown,Trump threatens US tolls on Hormuz after Iran says strait is closed,-0.1,Neutral
"Sat, 20 Jun 2026 07:00:00 GMT",Unknown,"US CENTCOM: ‘Iran does not control the Strait of Hormuz,’ waterway remains open",0.0,Neutral
"Sat, 20 Jun 2026 07:00:00 GMT",Unknown,Iran closes Strait of Hormuz over ceasefire violations,0.0,Neutral
"Sat, 20 Jun 2026 07:00:00 GMT",Unknown,Video Iran says it will reclose Strait of Hormuz,0.5,Positive
"Sat, 20 Jun 2026 07:00:00 GMT",Unknown,Iran war: Ceasefire shaky as Strait of Hormuz tensions rise,-0.33,Negative
"Sat, 20 Jun 2026 07:00:00 GMT",Unknown,Iran Closes Strait of Hormuz Again and Says its Negotiating Team with US is Heading to Switzerland,0.0,Neutral
"Sat, 20 Jun 2026 07:00:00 GMT",Unknown,"U.S., Iran to talk Sunday in Switzerland as Tehran says it closed Strait of Hormuz again",-0.1,Neutral
"Sat, 20 Jun 2026 07:00:00 GMT",Unknown,"Iran has closed Strait of Hormuz, state media reports",-0.1,Neutral
"Sat, 20 Jun 2026 07:00:00 GMT",Unknown,Trump threatens to charge US tolls in Strait of Hormuz for 'services rendered as the Guardian Angel',0.0,Neutral
"Sat, 20 Jun 2026 07:00:00 GMT",Unknown,US disputes Iranian claims about closing Strait of Hormuz as negotiators arrive in Switzerland,0.0,Neutral
