Date,Source,Headline,Sentiment_Score,Sentiment_Label
"Mon, 20 Apr 2026 07:00:00 GMT",Unknown,How Will the Strait of Hormuz Blockade End?,0.0,Neutral
"Mon, 20 Apr 2026 07:00:00 GMT",Unknown,Beyond Panama and Hormuz: 8 critical waterways under the global microscope,0.0,Neutral
"Tue, 21 Apr 2026 07:00:00 GMT",Unknown,Strait of Hormuz reopening delayed,0.0,Neutral
"Tue, 21 Apr 2026 07:00:00 GMT",Unknown,"Trump, Iran and the Strait of Hormuz: here’s what happened overnight",0.0,Neutral
"Tue, 21 Apr 2026 07:00:00 GMT",Unknown,Three Ships Including an Iranian Vessel Cross Hormuz Strait,0.0,Neutral
"Tue, 21 Apr 2026 07:00:00 GMT",Unknown,Trump says Strait of Hormuz won’t reopen until Iran strikes a deal with US,0.0,Neutral
"Mon, 20 Apr 2026 07:00:00 GMT",Unknown,Hormuz Traffic at Standstill After Iran Abruptly Ends Reopening,-0.12,Neutral
"Tue, 21 Apr 2026 07:00:00 GMT",Unknown,US-Iran peace talks in jeopardy as Strait of Hormuz standoff continues,0.0,Neutral
"Mon, 20 Apr 2026 07:00:00 GMT",Unknown,"Standoff escalates over Strait of Hormuz | News, Sports, Jobs",0.0,Neutral
"Mon, 20 Apr 2026 07:00:00 GMT",Unknown,‘Hormuz moment’ could herald decline of US dominance: analysts,0.0,Neutral
"Tue, 21 Apr 2026 07:00:00 GMT",Unknown,2 Cruise Ships Clear Strait of Hormuz After Being Stranded for Weeks,0.11,Neutral
"Tue, 21 Apr 2026 07:00:00 GMT",Unknown,Hormuz Traffic Stays at a Trickle of Iran-Aligned Ships,0.0,Neutral
"Mon, 20 Apr 2026 07:00:00 GMT",Unknown,What Iran's Hormuz toll and romance scams have in common,-0.2,Neutral
"Tue, 21 Apr 2026 07:00:00 GMT",Unknown,Military planners to discuss Hormuz reopening in London,-0.1,Neutral
"Mon, 20 Apr 2026 07:00:00 GMT",Unknown,Strait of Hormuz Standoff Reignites Volatility,0.0,Neutral
"Mon, 20 Apr 2026 07:00:00 GMT",Unknown,Iran Shuts Access to Strait of Hormuz as U.S. Navy Seizes Iranian-Flagged Cargo Ship,0.0,Neutral
"Tue, 21 Apr 2026 07:00:00 GMT",Unknown,"Trump Extends Iran Ceasefire, Keeps Strait of Hormuz Blockade",0.0,Neutral
"Mon, 20 Apr 2026 07:00:00 GMT",Unknown,HORMUZ TRACKER: Traffic Slows to Trickle as Opening Hopes Dashed,0.0,Neutral
"Tue, 21 Apr 2026 07:00:00 GMT",Unknown,Iran's likely grip on Hormuz as part of deal spreads panic in Gulf | Daily Sabah,0.0,Neutral
"Mon, 20 Apr 2026 07:00:00 GMT",Unknown,Strait of Hormuz: ground zero for America vs. Iran,0.0,Neutral
"Mon, 20 Apr 2026 07:00:00 GMT",Unknown,IRGC Defines New Route for Ship Transit in the Strait of Hormuz,0.14,Neutral
"Tue, 21 Apr 2026 07:00:00 GMT",Unknown,Trump says he's not under pressure over Iran war deal as status of peace talks remains unclear,0.0,Neutral
"Tue, 21 Apr 2026 07:00:00 GMT",Unknown,"Xi Jinping calls for ceasefire in Iran war, says Strait of Hormuz should be reopened",0.0,Neutral
"Mon, 20 Apr 2026 07:00:00 GMT",Unknown,Easing Hormuz’s Grip for the Long Term,-0.05,Neutral
"Tue, 21 Apr 2026 07:00:00 GMT",Unknown,UN Agency Prepares Hormuz Evacuation Plan for Hundreds of Ships,0.0,Neutral
"Tue, 21 Apr 2026 07:00:00 GMT",Unknown,Carriers shift trapped Hormuz vessels into regional shuttles as alternative hubs take centre stage,-0.2,Neutral
"Tue, 21 Apr 2026 07:00:00 GMT",Unknown,Strait Of Hormuz Disruptions Recast CF Industries Supply And Valuation Story,0.0,Neutral
"Tue, 21 Apr 2026 07:00:00 GMT",Unknown,Who Suffers Most if the Strait of Hormuz Stays Shut?,-0.05,Neutral
"Tue, 21 Apr 2026 07:00:00 GMT",Unknown,Confused Closures and Opaque Openings: Continuing Dramas in the Hormuz Strait,-0.4,Negative
"Mon, 20 Apr 2026 07:00:00 GMT",Unknown,"Iran says Strait of Hormuz closed again, Trump won’t ease blockade",-0.1,Neutral
"Tue, 21 Apr 2026 07:00:00 GMT",Unknown,"Hormuz Shipping Disruptions Show No End as Trump Extends Ceasefire, Maintains Blockade",0.0,Neutral
"Tue, 21 Apr 2026 07:00:00 GMT",Unknown,Top Oil Traders Warn Worst of Demand Hit From War Is Yet to Come,-0.25,Negative
"Mon, 20 Apr 2026 07:00:00 GMT",Unknown,Xi Jinping says Strait of Hormuz should be open in call with Saudi crown prince,0.0,Neutral
"Tue, 21 Apr 2026 03:15:11 GMT",Unknown,America’s Blockade in the Strait of Hormuz | John Vick on NEWSMAX TV,0.0,Neutral
"Tue, 21 Apr 2026 07:00:00 GMT",Unknown,IEA Strait of Hormuz Has Lost Its Status as Reliable Energy Route,-0.7,Negative
"Tue, 21 Apr 2026 07:00:00 GMT",Unknown,NBC-4 | Oil Prices Plunge as Iran Reopens Strait of Hormuz,0.0,Neutral
"Tue, 21 Apr 2026 07:00:00 GMT",Unknown,Alternative routes for Middle East oil and gas due to Hormuz disruption,-0.06,Neutral
"Tue, 21 Apr 2026 07:00:00 GMT",Unknown,Asia’s Largest Oil Buyers Are Running Low on Hormuz Alternatives,0.0,Neutral
"Tue, 21 Apr 2026 07:00:00 GMT",Unknown,Strait of Hormuz: How a threat became a playbook,0.0,Neutral
"Tue, 21 Apr 2026 07:00:00 GMT",Unknown,Two Ships Report Iranian Attacks in Strait of Hormuz,0.0,Neutral
"Mon, 20 Apr 2026 07:00:00 GMT",Unknown,More than 20 vessels pass Strait of Hormuz on Saturday,0.33,Positive
"Mon, 20 Apr 2026 07:00:00 GMT",Unknown,Hormuz Traffic at Standstill as US Vessel Seizure Widens Risk,0.0,Neutral
"Tue, 21 Apr 2026 07:00:00 GMT",Unknown,Shipping firm Maersk says transit through Strait of Hormuz should be avoided despite ceasefire,-0.2,Neutral
"Tue, 21 Apr 2026 07:00:00 GMT",Unknown,"Hormuz disruption raises risk of global food shock, traders warn",0.0,Neutral
"Tue, 21 Apr 2026 07:00:00 GMT",Unknown,UN’s Maritime Agency Prepares Hormuz Evacuation Plan for Hundreds of Ships,0.0,Neutral
"Mon, 20 Apr 2026 07:00:00 GMT",Unknown,Gold Drops 2% as Iran Shuts Strait of Hormuz Again,0.0,Neutral
"Tue, 21 Apr 2026 07:00:00 GMT",Unknown,"Hormuz is just a ‘dry run’ if China and U.S. go to war in the Pacific, Singapore foreign minister warns",-0.1,Neutral
"Mon, 20 Apr 2026 07:00:00 GMT",Unknown,U.S. shoots at Iranian ship and seizes it as Strait of Hormuz tensions run high,0.16,Neutral
"Tue, 21 Apr 2026 07:00:00 GMT",Unknown,Strait of Hormuz blockade drives up costs at Panama Canal,0.0,Neutral
"Tue, 21 Apr 2026 07:00:00 GMT",Unknown,"Scam messages seek crypto for ships’ safe passage through Hormuz, firm warns",0.15,Neutral
"Mon, 20 Apr 2026 07:00:00 GMT",Unknown,Reuters: Trump Reviewing Pakistan’s Proposal to Lift Blockade of Strait of Hormuz,0.0,Neutral
"Tue, 21 Apr 2026 07:00:00 GMT",Unknown,Xi Intervenes to Open Hormuz,-0.1,Neutral
"Mon, 20 Apr 2026 07:00:00 GMT",Unknown,"China urges 'comprehensive' ceasefire, normal passage via Strait of Hormuz amid US-Iran conflict",0.15,Neutral
"Mon, 20 Apr 2026 07:00:00 GMT",Unknown,US seizure of Iranian ship near Strait of Hormuz | FOX 5 AT 4AM,0.1,Neutral
"Mon, 20 Apr 2026 07:00:00 GMT",Unknown,"Lucy and the Football, in the Persian Gulf",0.0,Neutral
"Wed, 22 Apr 2026 07:00:00 GMT",Unknown,The Strait of Hormuz in 8 Charts,-0.05,Neutral
"Wed, 22 Apr 2026 07:00:00 GMT",Unknown,More confusion looms over Strait of Hormuz after Iran attacks three ships near waterway,0.3,Positive
"Wed, 22 Apr 2026 07:00:00 GMT",Unknown,Trump’s Iran Ceasefire Has Been Extended. So Has the Hormuz Standoff.,-0.12,Neutral
"Wed, 22 Apr 2026 07:00:00 GMT",Unknown,How India Is Addressing the Strait of Hormuz Crisis,0.0,Neutral
"Wed, 22 Apr 2026 07:00:00 GMT",Unknown,The Strait of Hormuz shows how everything is now about leverage,0.0,Neutral
"Wed, 22 Apr 2026 07:00:00 GMT",Unknown,Air War in Iran Gives Way to Crippling Stalemate in Hormuz,0.0,Neutral
"Wed, 22 Apr 2026 07:00:00 GMT",Unknown,"Iran fires on 3 ships in the Strait of Hormuz, complicating efforts to resume U.S. ceasefire talks",0.0,Neutral
"Wed, 22 Apr 2026 07:00:00 GMT",Unknown,Iran Again Tightens Its Grip on Shipping in the Strait of Hormuz,0.14,Neutral
"Wed, 22 Apr 2026 07:00:00 GMT",Unknown,Insurance rates have spiked for vessels transiting the Strait of Hormuz,0.0,Neutral
"Wed, 22 Apr 2026 07:00:00 GMT",Unknown,Iran reports seizing 2 ships in Strait of Hormuz hours after Trump’s ceasefire extension,0.0,Neutral
"Wed, 22 Apr 2026 07:00:00 GMT",Unknown,Tehran Says It Has Seized Two Ships in Strait of Hormuz as Iranian Adviser Argues Cease-Fire Means 'Nothing',0.0,Neutral
"Wed, 22 Apr 2026 07:00:00 GMT",Unknown,Blockading the Strait of Hormuz,-0.12,Neutral
"Wed, 22 Apr 2026 07:00:00 GMT",Unknown,China’s Growing Interest In Opening The Strait Of Hormuz,0.0,Neutral
"Wed, 22 Apr 2026 07:00:00 GMT",Unknown,"In the Strait of Hormuz, an intriguing portrait of its islanders",0.3,Positive
"Wed, 22 Apr 2026 07:00:00 GMT",Unknown,"Hormuz standoff the 'largest supply shock' ever experienced, says global energy expert",0.4,Positive
"Wed, 22 Apr 2026 07:00:00 GMT",Unknown,Danger Escalates in Strait of Hormuz as Iran Says It Seized 2 Cargo Ships,0.14,Neutral
"Wed, 22 Apr 2026 07:00:00 GMT",Unknown,"Ceasefire extension offers diplomatic opening, but tensions persist in Strait of Hormuz",0.1,Neutral
"Wed, 22 Apr 2026 07:00:00 GMT",Unknown,Seafarer talks about being trapped on the Strait of Hormuz: 'There is no safe place here',-0.08,Neutral
"Wed, 22 Apr 2026 07:00:00 GMT",Unknown,The Strait of Hormuz is today’s energy chokepoint. China is tomorrow’s.,0.0,Neutral
"Wed, 22 Apr 2026 07:00:00 GMT",Unknown,Iran says Strait of Hormuz cannot be opened due to ceasefire breaches,-0.12,Neutral
"Wed, 22 Apr 2026 07:00:00 GMT",Unknown,Oil Futures Rise As Strait of Hormuz Stays Closed,-0.1,Neutral
"Wed, 22 Apr 2026 07:00:00 GMT",Unknown,Iran attacks ships in Hormuz Strait as the U.S. continues its blockade amid ceasefire,0.0,Neutral
"Wed, 22 Apr 2026 07:00:00 GMT",Unknown,"Crypto scam lures ships into Strait of Hormuz, falsely promising safe passage",0.35,Positive
"Wed, 22 Apr 2026 07:00:00 GMT",Unknown,Strait of Hormuz remains basically closed as Iran seizes ships after Trump ceasefire extension,-0.1,Neutral
"Wed, 22 Apr 2026 07:00:00 GMT",Unknown,At least 2 ships attacked in Strait of Hormuz after Trump announces indefinite extension of Iran ceasefire,-0.3,Negative
"Wed, 22 Apr 2026 07:00:00 GMT",Unknown,"Iran attacks vessels in Hormuz, avoids concrete stance on ceasefire extension",0.08,Neutral
"Wed, 22 Apr 2026 07:00:00 GMT",Unknown,"‘Impossible’ to reopen strait of Hormuz amid ‘flagrant’ ceasefire breaches, Iran says",-0.67,Negative
"Wed, 22 Apr 2026 07:00:00 GMT",Unknown,Iran seizes ships in Strait of Hormuz after Trump extends ceasefire,0.0,Neutral
"Wed, 22 Apr 2026 07:00:00 GMT",Unknown,A Taiwan crisis would cause far more global economic damage than Strait of Hormuz disruption,0.2,Neutral
"Wed, 22 Apr 2026 07:00:00 GMT",Unknown,Iran says it has seized two ships in Strait of Hormuz after U.S. extends ceasefire,0.0,Neutral
"Wed, 22 Apr 2026 07:00:00 GMT",Unknown,Iran seizes ships in Strait of Hormuz after US calls off renewed attacks,0.0,Neutral
"Wed, 22 Apr 2026 07:00:00 GMT",Unknown,Iran attacks ships in Strait of Hormuz as thousands more U.S. forces head for Middle East,0.25,Positive
"Wed, 22 Apr 2026 07:00:00 GMT",Unknown,Iran targets ships in Strait of Hormuz as U.S. talks remain uncertain,0.0,Neutral
"Wed, 22 Apr 2026 07:00:00 GMT",Unknown,War in Iran: Strait of Hormuz hostilities,0.0,Neutral
"Wed, 22 Apr 2026 07:00:00 GMT",Unknown,Iran Guards say two ships seized in Hormuz after ceasefire extension | Iran International,0.0,Neutral
"Wed, 22 Apr 2026 07:00:00 GMT",Unknown,"Mines in the Strait of Hormuz, Iran’s almost invisible weapon that has put the world’s most powerful navy in check",0.32,Positive
"Wed, 22 Apr 2026 07:00:00 GMT",Unknown,Ceasefire extended: Strait of Hormuz remains closed,-0.07,Neutral
"Wed, 22 Apr 2026 07:00:00 GMT",Unknown,Analysis of the Impact of the Strait of Hormuz Blockade on China’s Energy Market,0.0,Neutral
"Wed, 22 Apr 2026 07:00:00 GMT",Unknown,Iran fires on 3 ships in Strait of Hormuz hours after Trump extends ceasefire,0.0,Neutral
"Wed, 22 Apr 2026 07:00:00 GMT",Unknown,"Hormuz reopening 'not possible' amid US naval blockade, Iran says",0.0,Neutral
"Wed, 22 Apr 2026 07:00:00 GMT",Unknown,Iran Says It Seized Two Ships Near the Strait of Hormuz,0.11,Neutral
"Wed, 22 Apr 2026 07:00:00 GMT",Unknown,Iran targets MSC ships trying to break through Strait of Hormuz,0.0,Neutral
"Wed, 22 Apr 2026 07:00:00 GMT",Unknown,Beyond Hormuz: When Oil Markets Stop Reflecting Reality,0.0,Neutral
"Wed, 22 Apr 2026 07:00:00 GMT",Unknown,"Ships attacked in Strait of Hormuz. And, VA voters approve redistricting effort",0.0,Neutral
"Wed, 22 Apr 2026 07:00:00 GMT",Unknown,Iran war: Revolutionary Guard says seizes ships in Hormuz,0.0,Neutral
"Wed, 22 Apr 2026 07:00:00 GMT",Unknown,New scam promises ships safe passage through Strait of Hormuz: report,0.32,Positive
"Wed, 22 Apr 2026 07:00:00 GMT",Unknown,"Clearing Strait of Hormuz of mines could take 6 months, Pentagon tells Congress",0.0,Neutral
"Wed, 22 Apr 2026 07:00:00 GMT",Unknown,"Asian shipowners to cross Hormuz before Western firms, executives say",0.0,Neutral
"Wed, 22 Apr 2026 07:00:00 GMT",Unknown,Iran War Becomes Game of Brinkmanship in the Strait of Hormuz,-0.4,Negative
"Wed, 22 Apr 2026 07:00:00 GMT",Unknown,Iran says it has seized two ships in Strait of Hormuz after vessels attacked,0.0,Neutral
"Wed, 22 Apr 2026 07:00:00 GMT",Unknown,Food security: Why UN chief Guterres’s plan to get fertiliser flowing in Hormuz is stalling,0.0,Neutral
"Wed, 22 Apr 2026 07:00:00 GMT",Unknown,Gulf worries US-Iran talks may cement Tehran's 'golden' grip on Hormuz,0.3,Positive
"Wed, 22 Apr 2026 07:00:00 GMT",Unknown,Three Ships Fired Upon in the Strait of Hormuz...,0.0,Neutral
"Wed, 22 Apr 2026 07:00:00 GMT",Unknown,Apple controls the tech sector’s Strait of Hormuz,0.0,Neutral
"Wed, 22 Apr 2026 07:00:00 GMT",Unknown,Iran Menaces Hormuz as Its Own Oil Tankers Test US Blockade,0.6,Positive
"Wed, 22 Apr 2026 07:00:00 GMT",Unknown,Watch Strait of Hormuz: Iranian Oil Tankers Go Dark to Sail Past US Blockade,-0.2,Neutral
"Wed, 22 Apr 2026 07:00:00 GMT",Unknown,Iran seizes ships in Strait of Hormuz amid U.S. blockade,0.0,Neutral
"Wed, 22 Apr 2026 07:00:00 GMT",Unknown,Iran seizes ships in Strait of Hormuz after White House indefinitely extends ceasefire,0.0,Neutral
"Wed, 22 Apr 2026 07:00:00 GMT",Unknown,Singapore foreign minister: Strait of Hormuz chaos a 'dry run' for if U.S.-China conflict emerges,-0.1,Neutral
"Wed, 22 Apr 2026 07:00:00 GMT",Unknown,Iran attacks ships in Strait of Hormuz,0.0,Neutral
"Wed, 22 Apr 2026 07:00:00 GMT",Unknown,Trump says Iran ‘collapsing’ over Hormuz blockade as IRGC attacks ships in key waterway,0.0,Neutral
"Wed, 22 Apr 2026 07:00:00 GMT",Unknown,Iran appears to launch more strikes on ships in Strait of Hormuz,0.5,Positive
"Wed, 22 Apr 2026 07:00:00 GMT",Unknown,Live updates: Iran attacks 3 ships in Strait of Hormuz as Trump extends ceasefire,0.14,Neutral
"Wed, 22 Apr 2026 07:00:00 GMT",Unknown,Escape from Hormuz: the oil tankers running the Iranian gauntlet,0.0,Neutral
"Wed, 22 Apr 2026 07:00:00 GMT",Unknown,Report: Removing Mines From Strait of Hormuz Could Take Six Months,0.0,Neutral
"Tue, 21 Apr 2026 07:00:00 GMT",Unknown,More Cruise Ships Safely Cross Strait of Hormuz After Being Stranded For Weeks,0.25,Positive
"Wed, 22 Apr 2026 07:00:00 GMT",Unknown,Brent oil price tops $103 with Hormuz shipping still disrupted during U.S.-Iran ceasefire,0.0,Neutral
"Wed, 22 Apr 2026 07:00:00 GMT",Unknown,Gulf markets fall as Hormuz closure dulls ceasefire optimism,-0.1,Neutral
"Wed, 22 Apr 2026 07:00:00 GMT",Unknown,"Iran says it seized 2 ships in Strait of Hormuz, hours after Trump’s ceasefire extension",0.0,Neutral
"Wed, 22 Apr 2026 07:00:00 GMT",Unknown,'Inaccurate reports': CENTCOM denies media allegations of ships breaking Hormuz blockade,0.0,Neutral
"Wed, 22 Apr 2026 07:00:00 GMT",Unknown,Six Cruise Ships Transit the Strait of Hormuz During U.S.-Iran Ceasefire,0.0,Neutral
"Wed, 22 Apr 2026 07:00:00 GMT",Unknown,Attacks reported in Strait of Hormuz,0.0,Neutral
"Wed, 22 Apr 2026 07:00:00 GMT",Unknown,Iran fires on 3 ships in Strait of Hormuz amid supposedly indefinite cease-fire,0.0,Neutral
"Wed, 22 Apr 2026 07:00:00 GMT",Unknown,"Iran Seizes 2 Ships In Strait Of Hormuz—Third Ship Attacked, State Media Claims",0.0,Neutral
"Wed, 22 Apr 2026 07:00:00 GMT",Unknown,Iran captures two vessels in Strait of Hormuz after ship comes under fire,0.0,Neutral
"Wed, 22 Apr 2026 07:00:00 GMT",Unknown,Iran Conditions Strait of Hormuz Reopening on End of U.S. Naval Blockade,0.0,Neutral
"Wed, 22 Apr 2026 07:00:00 GMT",Unknown,Strait of Hormuz is hosting gunboat diplomacy as US and Iran vie for most effective blockade,0.55,Positive
"Thu, 23 Apr 2026 07:00:00 GMT",Unknown,"France, UK’s Hormuz mission raises more questions than answers",0.5,Positive
"Thu, 23 Apr 2026 07:00:00 GMT",Unknown,Trump orders U.S. military to 'shoot and kill' Iranian small boats choking Strait of Hormuz,-0.17,Neutral
"Thu, 23 Apr 2026 07:00:00 GMT",Unknown,"Despite ceasefire, Hormuz tensions continue to throttle supply chains worldwide",0.0,Neutral
"Thu, 23 Apr 2026 07:00:00 GMT",Unknown,Pentagon dismisses report it could take 6 months to reopen Strait of Hormuz,0.0,Neutral
"Thu, 23 Apr 2026 07:00:00 GMT",Unknown,Has the Strait of Hormuz emerged as Iran’s most powerful form of deterrence?,0.4,Positive
"Thu, 23 Apr 2026 07:00:00 GMT",Unknown,"Iran deploys more mines in the Strait of Hormuz, sources say",0.5,Positive
"Thu, 23 Apr 2026 07:00:00 GMT",Unknown,America doesn’t depend on the Strait of Hormuz — but rural Alaska does,0.0,Neutral
"Thu, 23 Apr 2026 07:00:00 GMT",Unknown,What is Europe's plan to secure the Strait of Hormuz?,0.4,Positive
"Thu, 23 Apr 2026 07:00:00 GMT",Unknown,Strait of Hormuz: Iran’s ‘nuclear deterrent’,0.0,Neutral
"Thu, 23 Apr 2026 07:00:00 GMT",Unknown,"First Thing: ‘Impossible’ to reopen strait of Hormuz amid ‘flagrant’ ceasefire breaches, Iran says",-0.21,Negative
"Thu, 23 Apr 2026 07:00:00 GMT",Unknown,Shipping Through Hormuz Remains Largely Frozen,0.21,Positive
"Wed, 22 Apr 2026 16:34:28 GMT",Unknown,IRAN SEIZES MSC CONTAINER SHIPS AS 'WEAPONIZATION OF TRADE' CONTINUES IN STRAIT OF HORMUZ,0.0,Neutral
"Thu, 23 Apr 2026 07:00:00 GMT",Unknown,"No quick rebound from Hormuz disruption, oil execs tell Dallas Fed",-0.17,Neutral
"Thu, 23 Apr 2026 07:00:00 GMT",Unknown,Trump claims US has total control over strait of Hormuz after Iran seizes two container ships,0.0,Neutral
"Thu, 23 Apr 2026 07:00:00 GMT",Unknown,"Iran seizes vessel in Strait of Hormuz, defying US naval superiority",0.0,Neutral
"Thu, 23 Apr 2026 07:00:00 GMT",Unknown,Gas price worries may linger into midterms if Hormuz mine-clearing timeline holds,0.0,Neutral
"Thu, 23 Apr 2026 07:00:00 GMT",Unknown,"US blockade of Hormuz successful despite media reports suggesting otherwise, maritime expert says",0.75,Positive
"Thu, 23 Apr 2026 07:00:00 GMT",Unknown,Video purportedly shows Iranian soldiers seizing ships in Strait of Hormuz,0.0,Neutral
"Thu, 23 Apr 2026 07:00:00 GMT",Unknown,How Iran raised Hormuz stakes by capturing ships,0.0,Neutral
"Thu, 23 Apr 2026 07:00:00 GMT",Unknown,US-Iran standoff in Strait of Hormuz escalates,0.0,Neutral
"Thu, 23 Apr 2026 07:00:00 GMT",Unknown,"Italy ready to deploy two minesweepers in Hormuz Strait, navy chief says",0.2,Neutral
"Thu, 23 Apr 2026 07:00:00 GMT",Unknown,US military developing plans to target Iran’s Strait of Hormuz defenses if ceasefire fails,-0.3,Negative
"Thu, 23 Apr 2026 07:00:00 GMT",Unknown,The Looming Food Crisis: Why the Strait of Hormuz Is Disrupting Global Agriculture,0.0,Neutral
"Thu, 23 Apr 2026 07:00:00 GMT",Unknown,Escaping the Strait of Hormuz – not worth the risk,-0.15,Neutral
"Thu, 23 Apr 2026 07:00:00 GMT",Unknown,Kalshi traders don't see Strait of Hormuz traffic returning to normal until July,0.15,Neutral
"Thu, 23 Apr 2026 07:00:00 GMT",Unknown,How the War in Iran Is Shifting From Bombardment to a Test of Wills,0.14,Neutral
"Thu, 23 Apr 2026 07:00:00 GMT",Unknown,Pentagon denies clearing Hormuz Strait mines will take six months,0.0,Neutral
"Thu, 23 Apr 2026 07:00:00 GMT",Unknown,Iran wants to charge ships to use the Strait of Hormuz. Can it legally do it?,0.2,Neutral
"Thu, 23 Apr 2026 07:00:00 GMT",Unknown,US military says it seizes another oil tanker associated with Iran,-0.1,Neutral
"Thu, 23 Apr 2026 07:00:00 GMT",Unknown,Trump orders US military to ‘shoot and kill’ Iranian small boats choking Strait of Hormuz,-0.17,Neutral
"Thu, 23 Apr 2026 07:00:00 GMT",Unknown,Trump orders Navy to ‘shoot and kill’ any boat laying mines in Strait of Hormuz,0.0,Neutral
"Thu, 23 Apr 2026 07:00:00 GMT",Unknown,Trump Threatens Iranian Boats He Says Are Mining the Strait of Hormuz,0.0,Neutral
"Thu, 23 Apr 2026 07:00:00 GMT",Unknown,Trump Orders U.S. Navy to 'Shoot and Kill' Any Boat Laying Mines in Strait of Hormuz,0.0,Neutral
"Thu, 23 Apr 2026 07:00:00 GMT",Unknown,Oil exporters scramble for routes beyond Hormuz — but there are no easy options,-0.22,Negative
"Thu, 23 Apr 2026 07:00:00 GMT",Unknown,Iran Claims It Has Banked First Revenue From Hormuz Tolls—Defying US Blockade,0.25,Positive
"Thu, 23 Apr 2026 07:00:00 GMT",Unknown,U.S.-Iran war evolves into naval standoff over Strait of Hormuz after both countries seize ships,0.0,Neutral
"Thu, 23 Apr 2026 07:00:00 GMT",Unknown,"US to ‘shoot and kill’ Iranian boats laying mines in Hormuz, Trump says",0.0,Neutral
"Thu, 23 Apr 2026 07:00:00 GMT",Unknown,"DC Wrap: Trump orders Iranian boats shot in strait, reclassifies medical pot",0.0,Neutral
"Thu, 23 Apr 2026 07:00:00 GMT",Unknown,The Hormuz crisis,-0.5,Negative
"Thu, 23 Apr 2026 07:00:00 GMT",Unknown,Trump's Op. Economic Fury pressure campaign on Iran expands beyond Hormuz blockade,0.2,Neutral
"Thu, 23 Apr 2026 07:00:00 GMT",Unknown,Trump says Strait of Hormuz will remain sealed until Iran makes a deal,0.0,Neutral
"Thu, 23 Apr 2026 07:00:00 GMT",Unknown,Shipping Through Hormuz Remains Largely Frozen After US Blockade,0.21,Positive
"Thu, 23 Apr 2026 07:00:00 GMT",Unknown,Live updates: Trump orders U.S. military to 'shoot and kill' Iranian boats mining Strait of Hormuz,0.02,Neutral
"Thu, 23 Apr 2026 07:00:00 GMT",Unknown,U.S. sailor en route to Strait of Hormuz sidelined by monkey attack,-0.05,Neutral
"Fri, 24 Apr 2026 07:00:00 GMT",Unknown,Encouraging European Military Efforts to Reopen the Strait of Hormuz,-0.05,Neutral
"Fri, 24 Apr 2026 07:00:00 GMT",Unknown,No safe transit through Strait of Hormuz: IMO Secretary-General,-0.17,Neutral
"Fri, 24 Apr 2026 07:00:00 GMT",Unknown,How Iran is wielding the Strait of Hormuz as leverage,0.0,Neutral
"Fri, 24 Apr 2026 07:00:00 GMT",Unknown,How many large tankers are crossing the Strait of Hormuz?,0.36,Positive
"Fri, 24 Apr 2026 07:00:00 GMT",Unknown,The Peril of Piloting Ships Through the Strait of Hormuz,0.14,Neutral
"Fri, 24 Apr 2026 07:00:00 GMT",Unknown,The Strait of Hormuz energy crisis shows the EU’s carbon pricing is the right approach,0.29,Positive
"Fri, 24 Apr 2026 07:00:00 GMT",Unknown,Europe Pushes For Stability And Free Navigation In Strait Of Hormuz,0.4,Positive
"Fri, 24 Apr 2026 07:00:00 GMT",Unknown,"Gunboat diplomacy ramps up in Hormuz Strait, endangering shaky ceasefire",-0.33,Negative
"Fri, 24 Apr 2026 07:00:00 GMT",Unknown,Both Iran and U.S. Blockade Strait of Hormuz,0.14,Neutral
"Fri, 24 Apr 2026 07:00:00 GMT",Unknown,Russia Gets Exemption From Iran’s Strait of Hormuz Toll,0.0,Neutral
"Fri, 24 Apr 2026 07:00:00 GMT",Unknown,How long can Iran survive the US’s Hormuz blockade?,-0.05,Neutral
"Fri, 24 Apr 2026 07:00:00 GMT",Unknown,Iran-Iraq Tanker War redux? Why the Strait of Hormuz crisis is different,0.0,Neutral
"Fri, 24 Apr 2026 07:00:00 GMT",Unknown,Analysis: The US protected ships from Iran in the Strait of Hormuz in the '80s. Could it again?,0.0,Neutral
"Fri, 24 Apr 2026 07:00:00 GMT",Unknown,Strait of Hormuz Becomes the Biggest Test of US-Iran Ceasefire,0.0,Neutral
"Fri, 24 Apr 2026 07:00:00 GMT",Unknown,Strait Of Hormuz Crisis Sparks Cryptocurrency Shipping Scam,0.0,Neutral
"Fri, 24 Apr 2026 07:00:00 GMT",Unknown,Hormuz at the Centre: How the Iran Conflict is Being Redefined,0.0,Neutral
"Fri, 24 Apr 2026 07:00:00 GMT",Unknown,"Naval escorts will likely be needed when Strait of Hormuz reopens, Chevron CEO says",0.0,Neutral
"Fri, 24 Apr 2026 07:00:00 GMT",Unknown,"Strait of Hormuz may not fully reopen until second half of 2026, Baker Hughes says",-0.08,Neutral
"Fri, 24 Apr 2026 07:00:00 GMT",Unknown,Israel/US-Iran conflict 2026: Reopening the Strait of Hormuz,0.0,Neutral
"Fri, 24 Apr 2026 07:00:00 GMT",Unknown,Oil Posts Weekly Gains on Continued Hormuz Closure,0.0,Neutral
"Fri, 24 Apr 2026 07:00:00 GMT",Unknown,Iran fires on 3 ships in the Strait of Hormuz as US maintains blockade and diplomacy stalls,0.0,Neutral
"Thu, 23 Apr 2026 07:00:00 GMT",Unknown,Strait of Hormuz traffic remains limited amid uncertainty over US-Iran ceasefire,-0.07,Neutral
"Fri, 24 Apr 2026 07:00:00 GMT",Unknown,What Hormuz Whiplash Means For Markets,0.0,Neutral
"Fri, 24 Apr 2026 07:00:00 GMT",Unknown,'A dangerous standoff' as Strait of Hormuz blockade continues,-0.6,Negative
"Fri, 24 Apr 2026 07:00:00 GMT",Unknown,"Oil rises above $106 per barrel as US, Iran deadlocked in Strait of Hormuz",0.0,Neutral
"Fri, 24 Apr 2026 07:00:00 GMT",Unknown,Former NATO commander: Halting mine-laying vessels ‘key to unlocking’ Strait of Hormuz,0.0,Neutral
"Fri, 24 Apr 2026 07:00:00 GMT",Unknown,"Gulf oil output likely to rebound within months after Hormuz reopening, Goldman says",0.0,Neutral
"Fri, 24 Apr 2026 07:00:00 GMT",Unknown,Oil price surge tied to Strait of Hormuz tensions squeezes Arkansas truckers,0.0,Neutral
"Fri, 24 Apr 2026 07:00:00 GMT",Unknown,Hormuz closure triggers ‘havoc’ for project logistics supply chain,0.0,Neutral
"Thu, 23 Apr 2026 07:00:00 GMT",Unknown,Iran seizes 2 container ships in Strait of Hormuz,0.0,Neutral
