Date,Source,Headline,Sentiment_Score,Sentiment_Label
"Thu, 14 May 2026 07:00:00 GMT",Unknown,"China and U.S. agree Hormuz shouldn’t be ‘militarized,’ Marco Rubio says",0.0,Neutral
"Thu, 14 May 2026 07:00:00 GMT",Unknown,Second Japan-linked oil tanker sails via Strait of Hormuz as PM asks Iran to help out,0.0,Neutral
"Thu, 14 May 2026 07:00:00 GMT",Unknown,"China will do what it can to reopen Strait of Hormuz, Bessent says",0.0,Neutral
"Thu, 14 May 2026 07:00:00 GMT",Unknown,Oil ends flat as tanker crossings through Strait of Hormuz temper supply fears,-0.03,Neutral
"Thu, 14 May 2026 07:00:00 GMT",Unknown,Tensions flare near Strait of Hormuz as a ship is seized and another is sunk,0.1,Neutral
"Thu, 14 May 2026 07:00:00 GMT",Unknown,Ship seized off coast of UAE near Strait of Hormuz may have been 'floating armory': report,0.1,Neutral
"Thu, 14 May 2026 07:00:00 GMT",Unknown,Oil Prices Stay Stuck Despite ‘Consensus’ That Strait of Hormuz Will Reopen in June,0.0,Neutral
"Thu, 14 May 2026 07:00:00 GMT",Unknown,"Ship said seized, diverted to Iran, another sunk, in latest Strait of Hormuz actions",0.5,Positive
"Thu, 14 May 2026 07:00:00 GMT",Unknown,Asia bears the brunt of the Hormuz crisis,0.0,Neutral
"Thu, 14 May 2026 07:00:00 GMT",Unknown,Two India-Bound LPG Tankers Add to Uptick in Hormuz Transits,0.0,Neutral
"Thu, 14 May 2026 07:00:00 GMT",Unknown,Rubio: China ‘not in favor’ of militarizing Strait of Hormuz,0.0,Neutral
"Thu, 14 May 2026 07:00:00 GMT",Unknown,"Xi, Trump agree 'Hormuz must remain open,' says White House after US-China summit in Beijing",0.0,Neutral
"Thu, 14 May 2026 07:00:00 GMT",Unknown,Vitol Offers Iraqi Oil Outside Hormuz in Sign of Ship Exits,0.05,Neutral
"Thu, 14 May 2026 07:00:00 GMT",Unknown,Iran allows Chinese ships to sail through the Strait of Hormuz,0.05,Neutral
"Thu, 14 May 2026 07:00:00 GMT",Unknown,Iran allows Chinese vessels through Hormuz; Israel threatens defamation suit against NYT; Over 60 killed in Sudan,-0.1,Neutral
"Thu, 14 May 2026 07:00:00 GMT",Unknown,View / China’s Iran calculus extends beyond Hormuz,0.0,Neutral
"Thu, 14 May 2026 07:00:00 GMT",Unknown,"Trump, Xi agree Strait of Hormuz must stay open and Iran can’t have nukes: White House",0.03,Neutral
"Thu, 14 May 2026 07:00:00 GMT",Unknown,Trump-Xi summit could produce ‘something substantial’ on the Strait of Hormuz closure: Analyst,0.0,Neutral
"Thu, 14 May 2026 07:00:00 GMT",Unknown,India’s Oil Crisis Deepens as Hormuz Remains Shut,0.0,Neutral
"Thu, 14 May 2026 07:00:00 GMT",Unknown,"Hormuz closure drives record tanker rates, boosts Teekay earnings",0.0,Neutral
"Thu, 14 May 2026 07:00:00 GMT",Unknown,India condemns sinking of vessel as ‘unacceptable’ as Strait of Hormuz crisis continues,0.0,Neutral
"Thu, 14 May 2026 07:00:00 GMT",Unknown,Iran's latest provocation in Gulf escalates tension over Strait of Hormuz,0.5,Positive
"Thu, 14 May 2026 07:00:00 GMT",Unknown,Japanese crude tanker emerges outside Hormuz in rare transit,-0.1,Neutral
"Thu, 14 May 2026 07:00:00 GMT",Unknown,Trump Cites Inaccurate Data to Downplay Economic Toll of Iran War,0.18,Neutral
"Thu, 14 May 2026 07:00:00 GMT",Unknown,"Strait of Hormuz closure could drive up costs beyond the gas pump, experts warn",0.0,Neutral
"Thu, 14 May 2026 07:00:00 GMT",Unknown,"Trump says Xi offered help to open Hormuz, vowed not to arm Iran",0.0,Neutral
"Wed, 13 May 2026 20:28:51 GMT",Unknown,China-Linked Vessels Transit Strait of Hormuz via Iran’s ‘Safe’ Corridor,0.5,Positive
"Thu, 14 May 2026 07:00:00 GMT",Unknown,"As Trump meets Xi, Iran lets Chinese ships through Strait of Hormuz",0.0,Neutral
"Thu, 14 May 2026 07:00:00 GMT",Unknown,Two India-Bound LPG Tankers Clear Hormuz in Dark Mode,-0.16,Neutral
"Thu, 14 May 2026 07:00:00 GMT",Unknown,"Trump says Beijing opposes Iranian toll in Hormuz, as Chinese vessels exit waterway",0.0,Neutral
"Thu, 14 May 2026 07:00:00 GMT",Unknown,New Attacks Hit Ships Near Hormuz as Trump Discusses Iran With Xi,0.12,Neutral
"Thu, 14 May 2026 07:00:00 GMT",Unknown,U.S. and China Agree to Keep Strait of Hormuz Open,0.0,Neutral
"Thu, 14 May 2026 07:00:00 GMT",Unknown,US Says Chinese Leader Xi Opposes Strait of Hormuz Toll,0.0,Neutral
"Thu, 14 May 2026 07:00:00 GMT",Unknown,Iran allows Chinese ships to pass through Strait of Hormuz,0.05,Neutral
"Thu, 14 May 2026 04:15:34 GMT",Unknown,Mr. Trump goes to Beijing: No Progress likely on Hormuz,0.0,Neutral
"Thu, 14 May 2026 07:00:00 GMT",Unknown,"Iran regime has ‘gun to our head’ over Strait of Hormuz, says former CIA boss",0.0,Neutral
"Thu, 14 May 2026 00:00:00 GMT",Unknown,"Watch Dow Is Hardly Moving Anything Through Hormuz, CEO Says",-0.29,Negative
"Thu, 14 May 2026 07:00:00 GMT",Unknown,Rubio Warns China amid Ship Seizure in the Strait of Hormuz,0.0,Neutral
"Thu, 14 May 2026 07:00:00 GMT",Unknown,"Trump, Xi agree Hormuz must stay open, White House says",0.0,Neutral
"Thu, 14 May 2026 07:00:00 GMT",Unknown,Chinese ships pass through Strait of Hormuz under Iran’s ‘management protocol’: Iranian media,0.0,Neutral
"Wed, 13 May 2026 07:00:00 GMT",Unknown,"Iraq, Pakistan Secure Oil Shipments via Hormuz with Iran Agreements",0.4,Positive
"Thu, 14 May 2026 07:00:00 GMT",Unknown,US Treasury chief says China may press Iran over Hormuz,0.0,Neutral
"Thu, 14 May 2026 07:00:00 GMT",Unknown,"Tension in Hormuz: Japanese Ship Departs, South Korea Points Finger at Iran",0.0,Neutral
"Thu, 14 May 2026 07:00:00 GMT",Unknown,Getting to yes on reopening Hormuz,0.0,Neutral
"Thu, 14 May 2026 07:00:00 GMT",Unknown,"How the Hormuz Energy Crisis Is Reshaping US, South Korea, and Japan Energy Cooperation",0.0,Neutral
"Thu, 14 May 2026 07:00:00 GMT",Unknown,Chinese Tankers Resume Hormuz Transit Under Iran Coordination,-0.23,Negative
"Thu, 14 May 2026 07:00:00 GMT",Unknown,IRGC media says Iran allowed some Chinese ships through Hormuz,0.0,Neutral
"Fri, 15 May 2026 07:00:00 GMT",Unknown,"Seized ship taken toward Iran as Trump and China's Xi agree Strait of Hormuz ""must remain open""",0.0,Neutral
"Fri, 15 May 2026 07:00:00 GMT",Unknown,Energy secretary: Strait of Hormuz will reopen ‘sometime this summer at latest’,0.5,Positive
"Fri, 15 May 2026 07:00:00 GMT",Unknown,Hormuz Traffic Increases as Iran Metes Out Passage for Political Gain,0.0,Neutral
"Fri, 15 May 2026 07:00:00 GMT",Unknown,Oil tankers transiting Strait of Hormuz since start of Iran war,0.0,Neutral
"Fri, 15 May 2026 07:00:00 GMT",Unknown,"Iran war day 77: Trump, Xi discuss Hormuz as Tehran rallies BRICS",0.0,Neutral
"Fri, 15 May 2026 07:00:00 GMT",Unknown,"Hormuz gives battered Iran room to wait out Trump, experts say",0.0,Neutral
"Fri, 15 May 2026 07:00:00 GMT",Unknown,Oman caught between US and Iran after Tehran’s claims of joint strait of Hormuz plan,0.0,Neutral
"Fri, 15 May 2026 07:00:00 GMT",Unknown,China's U.N. ambassador criticizes US Hormuz resolution,0.0,Neutral
"Fri, 15 May 2026 07:00:00 GMT",Unknown,Opinion | A simple step by Europe could loosen Iran’s grip on the Strait of Hormuz,0.0,Neutral
"Fri, 15 May 2026 07:00:00 GMT",Unknown,"From destroyers to drones, how a Europe-led coalition aims to open the Strait of Hormuz",0.0,Neutral
"Fri, 15 May 2026 07:00:00 GMT",Unknown,Hormuz crisis could lead to constructive dialogue between ASEAN and China in the South China Sea,0.0,Neutral
"Fri, 15 May 2026 07:00:00 GMT",Unknown,UAE's new oil pipeline push to double export capacity bypassing Hormuz,0.07,Neutral
"Fri, 15 May 2026 07:00:00 GMT",Unknown,UAE fast tracks second West-East oil pipeline to bypass Strait of Hormuz,0.1,Neutral
"Fri, 15 May 2026 07:00:00 GMT",Unknown,Trump’s Hormuz ship insurance facility has done $0 business,0.0,Neutral
"Fri, 15 May 2026 07:00:00 GMT",Unknown,UAE Will Double Oil Export Capacity Bypassing Hormuz by 2027,0.0,Neutral
"Fri, 15 May 2026 07:00:00 GMT",Unknown,Watch: BBC asks Trump if China will help open the Strait of Hormuz,0.0,Neutral
"Thu, 14 May 2026 07:00:00 GMT",Unknown,"Chinese supertanker exits Gulf, crossing Hormuz after months of delay",0.0,Neutral
"Fri, 15 May 2026 07:00:00 GMT",Unknown,UAE to accelerate new oil pipeline project to expand ability to bypass Hormuz,0.14,Neutral
"Fri, 15 May 2026 07:00:00 GMT",Unknown,Hormuz and the defense posture we don’t have,0.0,Neutral
"Fri, 15 May 2026 07:00:00 GMT",Unknown,Strait of Hormuz closure causes Diet Coke shortage in India as food brands brace for wider impacts,0.0,Neutral
"Fri, 15 May 2026 07:00:00 GMT",Unknown,UAE building a new pipeline bypassing Strait of Hormuz,0.14,Neutral
"Fri, 15 May 2026 07:00:00 GMT",Unknown,UAE to accelerate oil pipeline project to bypass Strait of Hormuz,0.0,Neutral
"Fri, 15 May 2026 07:00:00 GMT",Unknown,Iran eyes fees on Hormuz internet cables as new lever against the West,0.14,Neutral
"Fri, 15 May 2026 07:00:00 GMT",Unknown,UAE to complete second oil pipeline bypassing strait of Hormuz by 2027,0.05,Neutral
"Fri, 15 May 2026 07:00:00 GMT",Unknown,UAE building pipeline to double oil exports that can bypass Hormuz,0.0,Neutral
"Fri, 15 May 2026 07:00:00 GMT",Unknown,Oil Prices Surge as Hormuz Shutdown Keeps Supply Fears Alive,-0.17,Neutral
"Thu, 14 May 2026 14:13:00 GMT",Unknown,Report to Congress on Strait of Hormuz Non-oil Shipments and Effects on U.S. Shippers,0.0,Neutral
"Fri, 15 May 2026 07:00:00 GMT",Unknown,UAE to accelerate oil pipeline project to help bypass Hormuz amid Iran war fallout,0.0,Neutral
"Thu, 14 May 2026 18:14:40 GMT",Unknown,The Middle East conflict and the blocking of the Strait of Hormuz are fueling a global hunger crisis,0.0,Neutral
"Fri, 15 May 2026 07:00:00 GMT",Unknown,Strait of Hormuz standoff nears tipping point,0.0,Neutral
"Fri, 15 May 2026 07:00:00 GMT",Unknown,Iran allows energy giant’s ship to sail through Strait of Hormuz,0.0,Neutral
"Fri, 15 May 2026 07:00:00 GMT",Unknown,Greek-Operated Tanker Breaks Through Hormuz Gridlock,0.0,Neutral
"Fri, 15 May 2026 07:00:00 GMT",Unknown,The Hormuz Choke Point and the Twilight of Petroleum,-0.12,Neutral
"Fri, 15 May 2026 07:00:00 GMT",Unknown,Iran FM says Strait of Hormuz open to all vessels except nations 'at war with us'; says Tehran has 'no trust in US',0.0,Neutral
"Fri, 15 May 2026 07:00:00 GMT",Unknown,"China calls for Strait of Hormuz reopening ‘as soon as possible’, as Trump meets Xi again",0.0,Neutral
"Fri, 15 May 2026 07:00:00 GMT",Unknown,The Hormuz Quandary: Resilient Connectivity in the Geoeconomic Age,0.0,Neutral
"Thu, 14 May 2026 13:32:37 GMT",Unknown,Tensions Flare Up Over Strait of Hormuz as Ship Is Reported Seized and Heading Toward Iran,0.0,Neutral
"Fri, 15 May 2026 07:00:00 GMT",Unknown,The straight line running from Hormuz to Canada's housing market,0.13,Neutral
"Fri, 15 May 2026 07:00:00 GMT",Unknown,Average Minnesota gas prices rise further as Strait of Hormuz remains closed,-0.08,Neutral
"Fri, 15 May 2026 07:00:00 GMT",Unknown,Trump reveals Xi’s stance on arming Iran as Hormuz tensions rattle markets,0.0,Neutral
"Fri, 15 May 2026 07:00:00 GMT",Unknown,"Trump Departs China Without Agreements on Taiwan, Iran or Strait of Hormuz",0.0,Neutral
"Fri, 15 May 2026 07:00:00 GMT",Unknown,US says China wants Hormuz reopened without tolls or military control,0.05,Neutral
"Fri, 15 May 2026 07:00:00 GMT",Unknown,"Trump, Xi Project Hormuz Alignment Despite No Iran Progress",0.0,Neutral
"Fri, 15 May 2026 07:00:00 GMT",Unknown,How Iran’s Energy Exports Are Still Headed Toward China,0.14,Neutral
"Fri, 15 May 2026 07:00:00 GMT",Unknown,"Saudi Arabia runs 3,500-truck fleet to bypass Strait of Hormuz",0.0,Neutral
"Fri, 15 May 2026 07:00:00 GMT",Unknown,Oil climbs amid fears Hormuz may not reopen soon,0.0,Neutral
"Fri, 15 May 2026 07:00:00 GMT",Unknown,Clean Energy Seen as ‘Structurally Immune’ to Hormuz-Style Shock,0.37,Positive
"Sat, 16 May 2026 07:00:00 GMT",Unknown,"As Hormuz crisis rattles the world, eyes are on another key waterway",0.0,Neutral
"Sat, 16 May 2026 07:00:00 GMT",Unknown,China's position on the Hormuz Strait: What 'open' really means,0.12,Neutral
"Sat, 16 May 2026 07:00:00 GMT",Unknown,Iran to unveil new mechanism to manage Strait of Hormuz traffic,0.14,Neutral
"Sat, 16 May 2026 07:00:00 GMT",Unknown,Global oil stockpiles could hit record lows if Strait of Hormuz remains closed,-0.05,Neutral
"Sat, 16 May 2026 07:00:00 GMT",Unknown,"U.S., Iran stall on Hormuz reopening as oil supplies tighten",0.0,Neutral
"Sat, 16 May 2026 07:00:00 GMT",Unknown,Al Jazeera’s exclusive report from the Strait of Hormuz,0.0,Neutral
"Sat, 16 May 2026 05:21:53 GMT",Unknown,European allies lay groundwork for possible Hormuz maritime mission,0.0,Neutral
"Sat, 16 May 2026 07:00:00 GMT",Unknown,"US, Iran Stall on Hormuz Reopening as Oil Supplies Tighten",0.0,Neutral
"Sat, 16 May 2026 07:00:00 GMT",Unknown,Professor warns: This could happen to the economy if the Strait of Hormuz remains closed,-0.1,Neutral
"Fri, 15 May 2026 07:00:00 GMT",Unknown,Trump says Xi offered help on Iran as China seeks to keep Hormuz open,0.0,Neutral
"Sat, 16 May 2026 07:00:00 GMT",Unknown,Iran warns co-sponsors of US-backed Hormuz Strait resolution that they share responsibility for 'aggression',0.0,Neutral
"Sat, 16 May 2026 07:00:00 GMT",Unknown,Iraq exported 10 million barrels of oil through Strait of Hormuz in April,0.0,Neutral
"Sat, 16 May 2026 07:00:00 GMT",Unknown,Iranian Platform for Insuring Maritime Cargo in the Strait of Hormuz Launched,0.0,Neutral
"Fri, 15 May 2026 07:00:00 GMT",Unknown,Hormuz oil flows creep higher as more supertankers exit,0.38,Positive
"Sat, 16 May 2026 07:00:00 GMT",Unknown,Thailand urges Iran to allow safe passage of 8 stranded Thai vessels through Hormuz,0.5,Positive
"Sat, 16 May 2026 07:00:00 GMT",Unknown,BRICS Meeting: Araghchi Says Iran Will Always Safeguard Security in the Strait of Hormuz,0.0,Neutral
"Sat, 16 May 2026 07:00:00 GMT",Unknown,"European countries in talks with Tehran over Hormuz transit, Iranian media says",0.0,Neutral
"Sat, 16 May 2026 07:00:00 GMT",Unknown,Iran says new Hormuz transit fee mechanism to be 'unveiled soon',0.14,Neutral
"Sat, 16 May 2026 07:00:00 GMT",Unknown,Iran war: Strait of Hormuz transit fees introduced by Iran amid restrictions,0.0,Neutral
"Sat, 16 May 2026 07:00:00 GMT",Unknown,"Iran plans toll mechanism for Hormuz Strait transit, excludes vessels linked to US 'Freedom Project'",0.0,Neutral
"Fri, 15 May 2026 08:51:28 GMT",Unknown,26 world leaders issue statement on normalizing Strait of Hormuz,0.0,Neutral
"Sat, 16 May 2026 07:00:00 GMT",Unknown,Suezmax Tanker With Iraqi Crude Reaches India After Hormuz Transit,-0.7,Negative
"Sat, 16 May 2026 07:00:00 GMT",Unknown,Iran permits 30 vessels to pass through Strait of Hormuz overnight; Hezbollah strikes Israel,0.5,Positive
"Sat, 16 May 2026 07:00:00 GMT",Unknown,China’s Iran balancing act grows more costly,0.5,Positive
"Sat, 16 May 2026 07:00:00 GMT",Unknown,US energy chief says Hormuz could reopen by end of summer,0.0,Neutral
"Fri, 15 May 2026 07:00:00 GMT",Unknown,South Korea joins statement backing free navigation in Hormuz,0.4,Positive
"Fri, 15 May 2026 07:04:17 GMT",Unknown,Solving Hormuz: IMEC and the Future of Global Trade,0.0,Neutral
"Sat, 16 May 2026 07:00:00 GMT",Unknown,"Trump says Xi agrees Iran must open Hormuz strait, China says ‘no reason’ to continue war",0.0,Neutral
"Sat, 16 May 2026 07:00:00 GMT",Unknown,"Iran will announce Strait of Hormuz mechanism, collect fees, Iranian MP says",0.0,Neutral
"Sat, 16 May 2026 01:44:16 GMT",Unknown,China’s U.N. Ambassador Criticizes U.S. Hormuz Resolution,0.0,Neutral
"Fri, 15 May 2026 23:20:49 GMT",Unknown,"Sky News Australia. . The US is turning its focus back to the Strait of Hormuz, as President Donald Trump concludes his official visit to China.",0.0,Neutral
"Fri, 15 May 2026 20:28:54 GMT",Unknown,"Trump, Xi push Hormuz reopening as oil prices extend rally",0.0,Neutral
"Fri, 15 May 2026 07:00:00 GMT",Unknown,EIR analysts say market is moving closer to their forecast,0.0,Neutral
"Fri, 15 May 2026 07:00:00 GMT",Unknown,Will China Help Reopen Hormuz?,0.0,Neutral
"Fri, 15 May 2026 07:00:00 GMT",Unknown,"Xi signals support on Hormuz, yet China's next move is unclear: Expert",0.0,Neutral
"Fri, 15 May 2026 07:00:00 GMT",Unknown,"With Iran And UAE Present, India's 'Hormuz' Message To BRICS Nations",0.0,Neutral
"Fri, 15 May 2026 07:00:00 GMT",Unknown,Strait of Hormuz uncertainty chokes crude imports: India’s oil stock down 15% since US-Iran war; here’s w,-0.43,Negative
"Sat, 16 May 2026 07:00:00 GMT",Unknown,Iran to strengthen control of Hormuz by launching insurance scheme,0.0,Neutral
"Sat, 16 May 2026 07:00:00 GMT",Unknown,"Iran plans new Hormuz transit mechanism, says only cooperating nations will benefit",0.09,Neutral
"Fri, 15 May 2026 07:00:00 GMT",Unknown,The Emirates Accelerate A Pipeline Project To Bypass The Strait Of Hormuz,0.0,Neutral
"Fri, 15 May 2026 07:00:00 GMT",Unknown,"Sinking, seizure flare tensions in Hormuz",0.0,Neutral
"Fri, 15 May 2026 08:40:00 GMT",Unknown,Vitol Offers Iraqi Oil in Sign of Hormuz Transits,0.1,Neutral
"Sat, 16 May 2026 07:00:00 GMT",Unknown,Beijing’s Silence Is Fueling the Hormuz Crisis,0.0,Neutral
"Fri, 15 May 2026 07:00:00 GMT",Unknown,UAE Instructs ADNOC to Accelerate Pipeline Construction to Bypass Hormuz,0.0,Neutral
"Fri, 15 May 2026 12:49:48 GMT",Unknown,Nvidia-Led AI Rally Pushes US Stocks to Record Highs as Hormuz Oil Shock Drives Fed Rate Expectations,0.0,Neutral
"Fri, 15 May 2026 07:00:00 GMT",Unknown,2nd Japanese oil tanker passes through Strait of Hormuz,0.0,Neutral
"Fri, 15 May 2026 07:00:00 GMT",Unknown,UAE plots new oil pipeline to bypass Strait of Hormuz,0.14,Neutral
"Sat, 16 May 2026 07:00:00 GMT",Unknown,"Ship seized, another sunk near Hormuz",0.1,Neutral
"Fri, 15 May 2026 19:46:01 GMT",Unknown,"China, U.S. Agree That Hormuz Should Be Reopened Quickly",0.33,Positive
"Fri, 15 May 2026 07:00:00 GMT",Unknown,Donald Trump: Chinese President Offered Help to Reopen the Strait of Hormuz,0.0,Neutral
"Sat, 16 May 2026 07:00:00 GMT",Unknown,"Iran to soon unveil mechanism to manage traffic in Hormuz Strait along designated route, says Iranian lawmaker",0.0,Neutral
"Sat, 16 May 2026 07:00:00 GMT",Unknown,"78 ships 'redirected' from transiting Hormuz, says US military",-0.1,Neutral
"Fri, 15 May 2026 07:00:00 GMT",Unknown,Watch China Calls for Hormuz Reopening | The China Show 5/15/2026,0.0,Neutral
"Fri, 15 May 2026 07:00:00 GMT",Unknown,Oil Rises as Trump Departs China With Limited Progress on Hormuz,-0.07,Neutral
"Fri, 15 May 2026 07:00:00 GMT",Unknown,Trump claims China's Xi Jinping offered help to reopen Strait of Hormuz,0.0,Neutral
"Sun, 17 May 2026 07:00:00 GMT",Unknown,Iran eyes a new source of power deep beneath the Strait of Hormuz,0.07,Neutral
"Sun, 17 May 2026 07:00:00 GMT",Unknown,Iran war day 79: Tehran to unveil Hormuz toll plan; Israel bombs Lebanon,0.0,Neutral
"Sun, 17 May 2026 07:00:00 GMT",Unknown,Gridlock Persists in Hormuz While Blocked Tanker Sails On,0.0,Neutral
"Sun, 17 May 2026 07:00:00 GMT",Unknown,Iran Launches ‘Hormuz Safe’ Insurance Platform as Maritime Tensions Deepen in Strait of Hormuz,0.5,Positive
"Sun, 17 May 2026 07:00:00 GMT",Unknown,"Iran may be turning the Strait of Hormuz into a bitcoin-based insurance market, local reports say",0.0,Neutral
"Sun, 17 May 2026 07:00:00 GMT",Unknown,Washington's $40 billion Hormuz insurance fix: zero takers,0.0,Neutral
"Sun, 17 May 2026 07:00:00 GMT",Unknown,Sen. Lindsey Graham says status quo in the Strait of Hormuz is ‘hurting us all’,0.0,Neutral
"Sun, 17 May 2026 07:00:00 GMT",Unknown,G7 finance ministers to meet amid warning of economic consequences of prolonged Strait of Hormuz closure,0.2,Neutral
"Sun, 17 May 2026 07:00:00 GMT",Unknown,Al Jazeera reports from Strait of Hormuz on Iran’s plan to manage shipping,0.0,Neutral
"Sun, 17 May 2026 07:00:00 GMT",Unknown,US and Iran Far From Deal as Bond Rout Piles Pressure on Trump,0.1,Neutral
"Sun, 17 May 2026 07:00:00 GMT",Unknown,"Gold prices drop resulting from Strait of Hormuz closure, dealer says",0.0,Neutral
"Sun, 17 May 2026 07:00:00 GMT",Unknown,The US Now Ships Oil to Australia as the Strait of Hormuz Crisis Escalates,0.0,Neutral
"Sun, 17 May 2026 07:00:00 GMT",Unknown,"Strait of Hormuz expected to reopen ‘sometime this summer at latest’, US energy secretary says",0.2,Neutral
"Sun, 17 May 2026 07:00:00 GMT",Unknown,"Iran launches Hormuz Safe, a Bitcoin-backed insurance scheme for ships crossing the strait",0.5,Positive
"Sun, 17 May 2026 07:00:00 GMT",Unknown,Oil prices stay in the green even after Trump calls off planned Tuesday attack on Iran,-0.2,Neutral
"Sat, 16 May 2026 07:00:00 GMT",Unknown,Iran launches Hormuz Safe maritime insurance platform for vessels in Strait of Hormuz,0.5,Positive
"Sun, 17 May 2026 07:00:00 GMT",Unknown,Inside the UK-led mission to open the Strait of Hormuz,0.0,Neutral
"Sun, 17 May 2026 07:00:00 GMT",Unknown,Procopiou tanker leaves Strait of Hormuz as crude crossings tick up,-0.7,Negative
"Sun, 17 May 2026 07:00:00 GMT",Unknown,Trump warns Iran 'clock is ticking' amid Strait of Hormuz tensions,0.0,Neutral
"Sat, 16 May 2026 07:00:00 GMT",Unknown,Energy secretary: Strait of Hormuz will reopen ‘sometime this summer’,0.0,Neutral
"Sun, 17 May 2026 07:00:00 GMT",Unknown,Strait of Hormuz disruption is forcing Gulf transit towards pipelines and rail,0.0,Neutral
"Sat, 16 May 2026 13:19:00 GMT",Unknown,"Iran to announce mechanism to manage traffic, fees for Hormuz | Daily Sabah",0.0,Neutral
"Sun, 17 May 2026 07:00:00 GMT",Unknown,Trump's geopolitical brinkmanship has hit a wall with Iran,0.0,Neutral
"Sun, 17 May 2026 07:00:00 GMT",Unknown,Tehran asserts sovereignty over Strait of Hormuz shipping,0.0,Neutral
"Sat, 16 May 2026 07:00:00 GMT",Unknown,"Iran war day 78: Trump, Tehran signal talks as Lebanon truce extended",0.0,Neutral
"Sun, 17 May 2026 07:00:00 GMT",Unknown,The Iran War Is Crippling One of the World’s Wealthiest Nations,0.14,Neutral
"Sun, 17 May 2026 07:00:00 GMT",Unknown,Digital ‘catastrophe’?: Iran now eyes internet cables beneath Hormuz,0.0,Neutral
"Sun, 17 May 2026 07:00:00 GMT",Unknown,Trump again signals military option against Iran amid Hormuz tensions,-0.1,Neutral
"Sat, 16 May 2026 16:00:00 GMT",Unknown,Trump says Xi agrees that Iran should open Hormuz,0.0,Neutral
"Sun, 17 May 2026 07:00:00 GMT",Unknown,Strait of Hormuz Closure Impacts Global Coffee Industry,0.0,Neutral
"Sun, 17 May 2026 07:00:00 GMT",Unknown,Thailand Urges Iran to Ensure Safe Passage for Eight Thai Ships in the Strait of Hormuz,0.33,Positive
"Sun, 17 May 2026 07:00:00 GMT",Unknown,Russian envoy supports Beijing’s stance on Strait of Hormuz,0.0,Neutral
"Sun, 17 May 2026 07:00:00 GMT",Unknown,Hormuz tracker: Gridlock persists while blocked tanker sails on,0.0,Neutral
"Sun, 17 May 2026 06:48:00 GMT",Unknown,"Hormuz, Germany, drones and submarines",0.0,Neutral
"Sun, 17 May 2026 07:00:00 GMT",Unknown,Qatar warns against using Strait of Hormuz as ‘bargaining chip’,0.0,Neutral
"Sun, 17 May 2026 07:00:00 GMT",Unknown,Vietnam-Bound Supertanker Halted by US Navy Resumes Journey,0.0,Neutral
"Sun, 17 May 2026 07:00:00 GMT",Unknown,Mike Johnson Links Strait of Hormuz Crisis to GOP Midterm Hopes,0.0,Neutral
"Sun, 17 May 2026 07:00:00 GMT",Unknown,"Washington misread Hormuz: the market never closed, it just got pricey",0.05,Neutral
"Sun, 17 May 2026 07:00:00 GMT",Unknown,'Unacceptable': India condemns attacks on ships in Strait of Hormuz at UN,0.0,Neutral
"Sun, 17 May 2026 07:00:00 GMT",Unknown,Hormuz crisis: Can Iran really insure the world's oil lane?,0.2,Neutral
"Sat, 16 May 2026 12:55:27 GMT",Unknown,"Trump Says Xi Agrees Iran Must Open Strait, China Says War Should Not Have Started",0.0,Neutral
"Sun, 17 May 2026 07:00:00 GMT",Unknown,"At UN, India flags concerns over targeting of vessels in Strait of Hormuz",0.0,Neutral
"Sun, 17 May 2026 07:00:00 GMT",Unknown,"US, UK, France launch separate Hormuz security missions",0.0,Neutral
"Sat, 16 May 2026 07:00:00 GMT",Unknown,Global maritime firms race into West Africa as Hormuz disruption reshapes trade routes,0.0,Neutral
"Sun, 17 May 2026 07:00:00 GMT",Unknown,246 million barrels wiped from global oil inventories as Strait of Hormuz crisis threatens African fuel markets,0.0,Neutral
"Sat, 16 May 2026 07:00:00 GMT",Unknown,Iran announces mechanism to manage traffic through Strait of Hormuz,0.0,Neutral
"Sun, 17 May 2026 07:00:00 GMT",Unknown,Iran allows 30 ships through Hormuz as blockade tensions persist,0.0,Neutral
"Sat, 16 May 2026 07:00:00 GMT",Unknown,Iran lets Chinese ships through Hormuz as tensions flare,0.0,Neutral
"Sat, 16 May 2026 07:00:00 GMT",Unknown,Iran eases Hormuz transit for Chinese ships as oil steadies,0.0,Neutral
"Sat, 16 May 2026 07:00:00 GMT",Unknown,"Iran eases Hormuz controls, clears Chinese ships amid tensions",0.0,Neutral
"Sat, 16 May 2026 07:00:00 GMT",Unknown,"Bitcoin Drops Below $78,000 as Iran Makes Latest Threat on Hormuz",0.5,Positive
"Sun, 17 May 2026 07:00:00 GMT",Unknown,"US, Iran tensions escalate as Hormuz standoff widens",0.0,Neutral
"Sun, 17 May 2026 07:00:00 GMT",Unknown,Beijing talks falter as Hormuz crisis deepens,0.0,Neutral
"Sun, 17 May 2026 07:00:00 GMT",Unknown,Iran allows 30 ships through Hormuz amid UK military buildup,-0.1,Neutral
"Sat, 16 May 2026 08:21:12 GMT",Unknown,Hormuz traffic to resume by summer at latest: US energy chief,0.5,Positive
"Sat, 16 May 2026 07:00:00 GMT",Unknown,Iran seizes Chinese ‘floating armory’ near Hormuz amid crisis,0.05,Neutral
"Sun, 17 May 2026 07:00:00 GMT",Unknown,"China backs unrestricted Hormuz access, signals limits on Iran aid",0.0,Neutral
"Sat, 16 May 2026 07:00:00 GMT",Unknown,Iran allows limited Hormuz traffic as US-China talks stall,-0.07,Neutral
