Date,Source,Headline,Sentiment_Score,Sentiment_Label
"Sat, 28 Feb 2026 08:00:00 GMT",Unknown,Iran claims Hormuz closure as oil tanker traffic drops sharply,-0.08,Neutral
"Fri, 27 Feb 2026 08:00:00 GMT",Unknown,Iran and the Strait of Hormuz: risks to global energy prices,0.0,Neutral
"Sat, 28 Feb 2026 08:00:00 GMT",Unknown,"Iran's revolutionary guards tell ships passage through Strait of Hormuz 'not allowed', EU naval mission official says",0.0,Neutral
"Sat, 28 Feb 2026 08:00:00 GMT",Unknown,Iran says ‘no ship is allowed to pass’ Strait of Hormuz: Reports,0.2,Neutral
"Sat, 28 Feb 2026 08:00:00 GMT",Unknown,What to know about strategic Strait of Hormuz: AP explains,0.0,Neutral
"Sat, 28 Feb 2026 08:00:00 GMT",Unknown,Iran’s Weapon Of Mass Economic Destruction: Hormuz,0.17,Neutral
"Sat, 28 Feb 2026 08:00:00 GMT",Unknown,Can Iran Close The Strait Of Hormuz After U.S.-Israel Attacks?,0.0,Neutral
"Sat, 28 Feb 2026 08:00:00 GMT",Unknown,Shipping Traffic Through Strait of Hormuz Plummets After Attacks on Iran,0.14,Neutral
"Sat, 28 Feb 2026 08:00:00 GMT",Unknown,Strait of Hormuz Tensions Disrupt Gulf Oil Flows,0.0,Neutral
"Sat, 28 Feb 2026 08:00:00 GMT",Unknown,Iran: Ships' passage through Strait of Hormuz 'not allowed',0.0,Neutral
"Sat, 28 Feb 2026 08:00:00 GMT",Unknown,Strait of Hormuz: Key oil route in middle of Iran crisis,0.0,Neutral
"Sat, 28 Feb 2026 08:00:00 GMT",Unknown,Iran closes the Strait of Hormuz,-0.1,Neutral
"Sat, 28 Feb 2026 08:00:00 GMT",Unknown,"Iran Reportedly Closes Strait of Hormuz, the World's Most Vital Oil Export Route",0.24,Positive
"Sat, 28 Feb 2026 08:00:00 GMT",Unknown,Iran closes Strait of Hormuz,0.0,Neutral
"Sat, 28 Feb 2026 08:00:00 GMT",Unknown,"US calls on vessels to keep clear of Strait of Hormuz, surrounding waters amid military escalation",0.0,Neutral
"Sat, 28 Feb 2026 08:00:00 GMT",Unknown,"Oil markets on edge as Iran moves to restrict vital Strait of Hormuz shipping lane, report says",0.1,Neutral
"Sat, 28 Feb 2026 08:00:00 GMT",Unknown,Attack on Iran brings uncertainty for shipping via Strait of Hormuz,0.0,Neutral
"Sat, 28 Feb 2026 08:00:00 GMT",Unknown,"Japan shippers halt Hormuz operations after US, Israel strikes on Iran",0.0,Neutral
"Sat, 28 Feb 2026 08:00:00 GMT",Unknown,"Strikes In Iran Disrupt Strait of Hormuz, Report Says—A Key Oil Shipping Route",0.0,Neutral
"Sat, 28 Feb 2026 08:00:00 GMT",Unknown,Iranian Navy tells ships to avoid Strait of Hormuz,0.0,Neutral
"Sat, 28 Feb 2026 08:00:00 GMT",Unknown,How the attack on Iran could impact the global oil market and economy,0.0,Neutral
"Sat, 28 Feb 2026 08:00:00 GMT",Unknown,What is the Strait of Hormuz and why is it so important for oil?,0.4,Positive
"Sat, 28 Feb 2026 08:00:00 GMT",Unknown,Shipping security risk increases dramatically in Persian Gulf,0.0,Neutral
"Sat, 28 Feb 2026 08:00:00 GMT",Unknown,How strikes on Iran put focus on the Strait of Hormuz,0.0,Neutral
"Sat, 28 Feb 2026 08:00:00 GMT",Unknown,‘No ship allowed’: Iran blocks Strait of Hormuz; US urges ships to avoid Gulf after US-Israel strike,0.0,Neutral
"Sat, 28 Feb 2026 08:00:00 GMT",Unknown,"Iran begins maneuvers to close the Strait of Hormuz, a strategic point for international trade",0.0,Neutral
"Sat, 28 Feb 2026 08:00:00 GMT",Unknown,Iran moves to close Strait of Hormuz after strikes,0.0,Neutral
"Sat, 28 Feb 2026 08:00:00 GMT",Unknown,Live updates: US-Iran deal to be announced 'within hours',0.14,Neutral
"Sat, 28 Feb 2026 08:00:00 GMT",Unknown,Force majeure unlikely despite Strait of Hormuz shipping disruption: Analyst,-0.5,Negative
"Sun, 01 Mar 2026 08:00:00 GMT",Unknown,Statement on the Strait of Hormuz,0.0,Neutral
"Sun, 01 Mar 2026 08:00:00 GMT",Unknown,"Strait of Hormuz: if the Iran conflict shuts world’s most important oil chokepoint, global economic chaos could follow",0.28,Positive
"Sun, 01 Mar 2026 08:00:00 GMT",Unknown,Ocean lines flee Strait of Hormuz as Iran targets Persian Gulf ports,0.0,Neutral
"Sun, 01 Mar 2026 08:00:00 GMT",Unknown,What Happens if Iran Shuts Down the Strait of Hormuz?,-0.1,Neutral
"Sun, 01 Mar 2026 08:00:00 GMT",Unknown,$100 oil? Prolonged Hormuz closure could spark a 1970s-style energy shock,0.0,Neutral
"Sun, 01 Mar 2026 08:00:00 GMT",Unknown,War in Middle East: Tensions rise over Strait of Hormuz as tankers caught in crossfire,0.0,Neutral
"Sun, 01 Mar 2026 08:00:00 GMT",Unknown,What is the strait of Hormuz and why is it crucial for oil supplies?,0.0,Neutral
"Sun, 01 Mar 2026 08:00:00 GMT",Unknown,Ships avoid Strait of Hormuz as Iranian media essentially shuts it down,-0.08,Neutral
"Sun, 01 Mar 2026 08:00:00 GMT",Unknown,"Oil and gas majors and traders suspend shipments via Hormuz, sources say",0.0,Neutral
"Sun, 01 Mar 2026 08:00:00 GMT",Unknown,Oil tanker traffic disrupted in Strait of Hormuz main shipping lanes: CAS,0.11,Neutral
"Sun, 01 Mar 2026 08:00:00 GMT",Unknown,Beyond Oil: The Strait Of Hormuz And The Global Food Risk,0.0,Neutral
"Sun, 01 Mar 2026 08:00:00 GMT",Unknown,EXPLAINER: Why the Strait of Hormuz Could Shape the War’s Outcome,0.0,Neutral
"Sun, 01 Mar 2026 08:00:00 GMT",Unknown,"How US-Israel attacks on Iran threaten the Strait of Hormuz, oil markets",0.0,Neutral
"Sun, 01 Mar 2026 08:00:00 GMT",Unknown,Maps and charts of the Iran War,0.0,Neutral
"Sun, 01 Mar 2026 08:00:00 GMT",Unknown,War In The Gulf And Strait Of Hormuz,-0.2,Neutral
"Sun, 01 Mar 2026 08:00:00 GMT",Unknown,Russia warns of oil choke due to closure of Strait of Hormuz,-0.12,Neutral
"Sun, 01 Mar 2026 08:00:00 GMT",Unknown,"Ships avoid the Strait of Hormuz, tanker hit off Oman",0.0,Neutral
"Sun, 01 Mar 2026 08:00:00 GMT",Unknown,Strait of Hormuz Closure 'Not Formally Communicated': UKMTO,0.0,Neutral
"Sun, 01 Mar 2026 08:00:00 GMT",Unknown,"Hormuz erupts: Attacks, GPS jamming, Houthi threats rock Strait amid US-Israeli strikes",0.0,Neutral
"Sun, 01 Mar 2026 08:00:00 GMT",Unknown,Tanker ‘Skylight’ struck as Strait of Hormuz shipping threat intensifies amid fresh regional strikes,0.3,Positive
"Sun, 01 Mar 2026 08:00:00 GMT",Unknown,Video shows a ship under fire around the Strait of Hormuz,0.0,Neutral
"Sun, 01 Mar 2026 08:00:00 GMT",Unknown,Why the 24 mile wide Strait of Hormuz is so important in the war with Iran,0.15,Neutral
"Sun, 01 Mar 2026 08:00:00 GMT",Unknown,FACTBOX: Oil prices rally as US-Israel war with Iran disrupts Hormuz flows,0.0,Neutral
"Sun, 01 Mar 2026 08:00:00 GMT",Unknown,First oil tanker attacked in the Strait of Hormuz according to Oman,0.25,Positive
"Sun, 01 Mar 2026 08:00:00 GMT",Unknown,Black smoke pours from oil tanker near Strait of Hormuz,-0.03,Neutral
"Sun, 01 Mar 2026 08:00:00 GMT",Unknown,Fighting with Iran has spread to tankers at sea. Ships are coming under fire around the busy Strait of Hormuz.,0.1,Neutral
"Sun, 01 Mar 2026 08:00:00 GMT",Unknown,Iran Blocks Strait of Hormuz,0.0,Neutral
"Sun, 01 Mar 2026 08:00:00 GMT",Unknown,The significance of the Strait of Hormuz,0.0,Neutral
"Sun, 01 Mar 2026 08:00:00 GMT",Unknown,Shipping traffic through Strait of Hormuz plummets after attacks on Iran,0.0,Neutral
"Sun, 01 Mar 2026 08:00:00 GMT",Unknown,US–Iran conflict: Tanker traffic in Strait of Hormuz not fully halted,0.0,Neutral
"Sun, 01 Mar 2026 08:00:00 GMT",Unknown,War paralyses global transit through Strait of Hormuz,0.0,Neutral
"Sun, 01 Mar 2026 08:00:00 GMT",Unknown,Israel Iran conflict: Why the closure of Strait of Hormuz is causing rising crude oil prices?,-0.7,Negative
"Mon, 02 Mar 2026 08:00:00 GMT",Unknown,Maritime security update: Gulf Region / Strait of Hormuz and Red Sea,0.0,Neutral
"Mon, 02 Mar 2026 08:00:00 GMT",Unknown,The Strait of Hormuz crisis explained: What it means for global shipping,0.0,Neutral
"Mon, 02 Mar 2026 08:00:00 GMT",Unknown,Oil Products Arbs and Flows: All Eyes On Strait of Hormuz,0.0,Neutral
"Mon, 02 Mar 2026 08:00:00 GMT",Unknown,Strait of Hormuz Maritime Blockade and Its Economic Impact,0.2,Neutral
"Mon, 02 Mar 2026 08:00:00 GMT",Unknown,Iran vows to attack any ship trying to pass through Strait of Hormuz,0.0,Neutral
"Mon, 02 Mar 2026 08:00:00 GMT",Unknown,Iran-U.S. war chokes key shipping lane and threatens global cargo industry,0.0,Neutral
"Mon, 02 Mar 2026 08:00:00 GMT",Unknown,What disrupting the strait of Hormuz could mean for global cost-of-living pressures,-0.16,Neutral
"Mon, 02 Mar 2026 08:00:00 GMT",Unknown,Iran says will attack any ship trying to pass through Strait of Hormuz,0.0,Neutral
"Mon, 02 Mar 2026 08:00:00 GMT",Unknown,Iran threatens to burn ships transiting the Strait of Hormuz,0.0,Neutral
"Mon, 02 Mar 2026 08:00:00 GMT",Unknown,"Strait of Hormuz, the world's most critical oil chokepoint",0.25,Positive
"Mon, 02 Mar 2026 08:00:00 GMT",Unknown,Energy prices surge as tanker disruptions and facility shutdowns rattle global supply,0.0,Neutral
"Mon, 02 Mar 2026 08:00:00 GMT",Unknown,Quarter of Maritime Oil Trade Flows Through Strait of Hormuz,0.0,Neutral
"Mon, 02 Mar 2026 08:00:00 GMT",Unknown,How western navies can keep the Strait of Hormuz open,0.0,Neutral
"Mon, 02 Mar 2026 08:00:00 GMT",Unknown,Oil and gas prices jump as conflict escalates,0.0,Neutral
"Mon, 02 Mar 2026 08:00:00 GMT",Unknown,"Iran-US conflict overview: Hormuz Strait closed, vessels seek shelter, carriers suspend bookings",-0.1,Neutral
"Mon, 02 Mar 2026 08:00:00 GMT",Unknown,All about the Strait of Hormuz and what's at stake if the key global oil supply route is disrupted by war,0.0,Neutral
"Mon, 02 Mar 2026 08:00:00 GMT",Unknown,The Strait of Hormuz Crisis: Iran Conflict Impact on Oil and Markets,0.0,Neutral
"Mon, 02 Mar 2026 08:00:00 GMT",Unknown,Oil surges after US-Israel strikes on Iran: Strait of Hormuz risk in focus,0.0,Neutral
"Sun, 01 Mar 2026 08:00:00 GMT",Unknown,What Happens If Iran Shuts Down the Strait of Hormuz?,-0.16,Neutral
"Mon, 02 Mar 2026 08:00:00 GMT",Unknown,Hormuz De Facto Closure: 8.7 Mbd at Risk as Duration Key,0.0,Neutral
"Mon, 02 Mar 2026 08:00:00 GMT",Unknown,"About 10% of global container fleet caught in Hormuz backup, shipping CEO says",0.0,Neutral
"Mon, 02 Mar 2026 08:00:00 GMT",Unknown,Strait of Hormuz closure sparks concern over possible global oil shock,0.0,Neutral
"Mon, 02 Mar 2026 08:00:00 GMT",Unknown,Shutdown of Hormuz Strait raises fears of soaring oil prices,0.0,Neutral
"Mon, 02 Mar 2026 08:00:00 GMT",Unknown,Oil prices soar amid worries of sustained war in Iran,0.0,Neutral
"Mon, 02 Mar 2026 08:00:00 GMT",Unknown,Asia’s main oil artery is all but blocked. What happens now?,0.17,Neutral
"Mon, 02 Mar 2026 08:00:00 GMT",Unknown,Oil soars amid Strait of Hormuz shipping fears as Iran war drives prices to nearly $80,0.1,Neutral
"Mon, 02 Mar 2026 08:00:00 GMT",Unknown,"Iran's Revolutionary Guards declare Strait of Hormuz closed, threaten to fire on any ship trying to pass",-0.1,Neutral
"Mon, 02 Mar 2026 08:00:00 GMT",Unknown,"Oil prices to remain high for days with Strait of Hormuz in spotlight, analysts say",0.16,Neutral
"Mon, 02 Mar 2026 08:00:00 GMT",Unknown,Hormuz traffic slows as Iran threatens to set 'ships on fire',0.0,Neutral
"Mon, 02 Mar 2026 08:00:00 GMT",Unknown,Video. Why the Strait of Hormuz is crucial to global oil and maritime trade,0.0,Neutral
"Mon, 02 Mar 2026 08:00:00 GMT",Unknown,"Fuel tanker ablaze in Strait of Hormuz after drone strike, Iran Revolutionary Guards say",0.0,Neutral
"Mon, 02 Mar 2026 08:00:00 GMT",Unknown,Strait of Hormuz under fire. Maritime transport in the Middle East suspended,0.0,Neutral
"Mon, 02 Mar 2026 08:00:00 GMT",Unknown,Business,0.17,Neutral
"Mon, 02 Mar 2026 08:00:00 GMT",Unknown,"Iran shuts down Strait of Hormuz, oil, and gas prices rise",-0.16,Neutral
"Mon, 02 Mar 2026 08:00:00 GMT",Unknown,Hormuz crisis is a wake-up call for complacent gas consumers,0.0,Neutral
"Mon, 02 Mar 2026 08:00:00 GMT",Unknown,Another oil tanker hit by drone boat as Strait of Hormuz tensions rise,0.0,Neutral
"Mon, 02 Mar 2026 08:00:00 GMT",Unknown,US Central Command: Strait of Hormuz Is Not Closed,0.03,Neutral
"Mon, 02 Mar 2026 08:00:00 GMT",Unknown,US-Israel strikes on Iran put focus on the Strait of Hormuz,0.0,Neutral
"Mon, 02 Mar 2026 08:00:00 GMT",Unknown,"Strait of Hormuz closure traps 3,200 ships inside the Middle East Gulf",0.0,Neutral
"Mon, 02 Mar 2026 08:00:00 GMT",Unknown,Maritime insurers cancel war risk cover in Gulf as Iran conflict disrupts shipping,0.0,Neutral
"Mon, 02 Mar 2026 08:00:00 GMT",Unknown,Iran's revolutionary guards commander says Strait of Hormuz is closed: Reuters,-0.1,Neutral
"Mon, 02 Mar 2026 08:00:00 GMT",Unknown,Iran ceases all shipping in Strait of Hormuz after U.S.-Israel strikes,0.0,Neutral
"Mon, 02 Mar 2026 08:00:00 GMT",Unknown,Strait of Hormuz closed as Iran war spills out into neighboring Gulf nations,-0.1,Neutral
"Mon, 02 Mar 2026 08:00:00 GMT",Unknown,Strait of Hormuz Disrupted After Iranian Attacks Near Oman｜Daily News Digest｜2026-03-02｜web only,0.05,Neutral
"Mon, 02 Mar 2026 08:00:00 GMT",Unknown,Gas prices soar and oil jumps as Iran war pushes down global stock markets,-0.08,Neutral
"Mon, 02 Mar 2026 08:00:00 GMT",Unknown,Oil soars amid Strait of Hormuz shipping fears as Iran war drives prices higher,0.25,Positive
"Mon, 02 Mar 2026 08:00:00 GMT",Unknown,"'Traffic jam of magnificent proportions', shipping through the Strait of Hormuz is on halt: Analyst",1.0,Positive
"Sun, 01 Mar 2026 08:00:00 GMT",Unknown,Ships avoid ‘closed’ Strait of Hormuz in hit to oil flows,-0.1,Neutral
"Mon, 02 Mar 2026 08:00:00 GMT",Unknown,What's happening around the Strait of Hormuz as conflict escalates?,0.0,Neutral
"Mon, 02 Mar 2026 08:00:00 GMT",Unknown,Iran warns ships to stay out of Strait of Hormuz: Why it matters,0.0,Neutral
"Mon, 02 Mar 2026 08:00:00 GMT",Unknown,Japan shipping companies halt operations in Strait of Hormuz,0.0,Neutral
"Mon, 02 Mar 2026 08:00:00 GMT",Unknown,Explained: What is the Strait of Hormuz and why the world is suddenly watching it after strikes on Iran,0.0,Neutral
"Mon, 02 Mar 2026 08:00:00 GMT",Unknown,The facts about the Strait of Hormuz,0.0,Neutral
"Mon, 02 Mar 2026 08:00:00 GMT",Unknown,Vessel traffic through Strait of Hormuz drops amid West Asia tensions,0.0,Neutral
"Mon, 02 Mar 2026 08:00:00 GMT",Unknown,Explainer: What happens if Iran closes the Strait of Hormuz?,0.0,Neutral
"Mon, 02 Mar 2026 08:00:00 GMT",Unknown,JUN KAJEE | How closing Iran’s Strait of Hormuz might affect the world,0.0,Neutral
"Tue, 03 Mar 2026 08:00:00 GMT",Unknown,Global Markets and the Strait of Hormuz: The Economic Shockwaves of the Iran War,0.06,Neutral
"Tue, 03 Mar 2026 08:00:00 GMT",Unknown,The Strait of Hormuz is facing a blockade. These countries will be most impacted,0.5,Positive
"Tue, 03 Mar 2026 08:00:00 GMT",Unknown,Strait of Hormuz Closure: Impacts on Oil and Supply Chains,0.0,Neutral
"Tue, 03 Mar 2026 08:00:00 GMT",Unknown,"Trump: U.S. Navy May Escort Tankers Through Strait of Hormuz, More European Warships en Route to Med",0.25,Positive
"Tue, 03 Mar 2026 08:00:00 GMT",Unknown,"Strait of Hormuz Global Oil, Gas Trade Disrupted Amid Iran War",0.0,Neutral
"Tue, 03 Mar 2026 08:00:00 GMT",Unknown,"What is the Strait of Hormuz, and why does its closure matter so much to the global economy?",0.1,Neutral
"Tue, 03 Mar 2026 08:00:00 GMT",Unknown,"Iran claims Hormuz Strait is closed, threatens to set shipping there ‘ablaze’",-0.1,Neutral
"Tue, 03 Mar 2026 08:00:00 GMT",Unknown,Is the Strait of Hormuz really closed to shipping?,-0.1,Neutral
"Tue, 03 Mar 2026 08:00:00 GMT",Unknown,US mulls military support for vulnerable oil supplies in Strait of Hormuz,-0.3,Negative
"Tue, 03 Mar 2026 08:00:00 GMT",Unknown,Iran has largely halted oil and gas exports through strait of Hormuz,0.21,Positive
"Tue, 03 Mar 2026 08:00:00 GMT",Unknown,Suspension of Strait of Hormuz Transits Due to Security Closure,-0.12,Neutral
"Tue, 03 Mar 2026 08:00:00 GMT",Unknown,Trump says US Navy could escort ships through Strait of Hormuz,0.0,Neutral
"Mon, 02 Mar 2026 08:00:00 GMT",Unknown,US-flagged tanker challenged by Iranian gunboats in Strait of Hormuz,0.0,Neutral
"Tue, 03 Mar 2026 08:00:00 GMT",Unknown,How War in the Middle East Is Choking Off the World’s Oil and Gas,0.05,Neutral
"Tue, 03 Mar 2026 08:00:00 GMT",Unknown,China Calls on All Sides to Protect Ships Transiting Hormuz,0.0,Neutral
"Tue, 03 Mar 2026 08:00:00 GMT",Unknown,Iran War: The US Has to Reopen the Strait of Hormuz as Soon as Possible,0.0,Neutral
"Tue, 03 Mar 2026 08:00:00 GMT",Unknown,Strait of Hormuz impasse squeezes world shipping,0.0,Neutral
"Tue, 03 Mar 2026 08:00:00 GMT",Unknown,The Strait of Hormuz crisis and its devastating impact on Asia-Gulf trade,-1.0,Negative
"Tue, 03 Mar 2026 08:00:00 GMT",Unknown,China presses Iran to keep Hormuz open as Asian buyers brace for LNG shortfalls | Iran International,0.0,Neutral
"Tue, 03 Mar 2026 08:00:00 GMT",Unknown,Trump says Navy will escort ships through Strait of Hormuz ‘if necessary’,0.0,Neutral
"Tue, 03 Mar 2026 08:00:00 GMT",Unknown,You may pay more for gas after Iran closes Strait of Hormuz oil route,0.5,Positive
"Tue, 03 Mar 2026 08:00:00 GMT",Unknown,"Tanker heads to UAE port via Strait of Hormuz to load oil, sources say",0.0,Neutral
"Tue, 03 Mar 2026 08:00:00 GMT",Unknown,4 numbers that explain why the Strait of Hormuz is so crucial in Iran war,0.0,Neutral
"Tue, 03 Mar 2026 08:00:00 GMT",Unknown,"Trump Says US Will Escort, Insure Tankers for Hormuz Routes",0.0,Neutral
"Tue, 03 Mar 2026 08:00:00 GMT",Unknown,News Content Hub,-0.1,Neutral
"Tue, 03 Mar 2026 08:00:00 GMT",Unknown,Oil supertanker rates hit all-time high as insurers drop war risk protection in the Middle East,0.08,Neutral
"Tue, 03 Mar 2026 08:00:00 GMT",Unknown,"China presses Iran not to block Strait of Hormuz, Bloomberg says",0.0,Neutral
"Tue, 03 Mar 2026 08:00:00 GMT",Unknown,China Pressures Iran to Keep Strait of Hormuz Open to Oil and Gas Flows,-0.23,Negative
"Tue, 03 Mar 2026 08:00:00 GMT",Unknown,China calls for vessels in strait of Hormuz to be protected amid soaring shipping costs,0.0,Neutral
"Tue, 03 Mar 2026 08:00:00 GMT",Unknown,Greek shipping minister warns of alarming situation in Strait of Hormuz,-0.05,Neutral
"Tue, 03 Mar 2026 08:00:00 GMT",Unknown,Oil prices ease after Trump says U.S. will insure tankers transiting Strait of Hormuz,0.0,Neutral
"Tue, 03 Mar 2026 08:00:00 GMT",Unknown,Strait of Hormuz disruption threatens Middle East food imports,0.0,Neutral
"Tue, 03 Mar 2026 08:00:00 GMT",Unknown,Oil prices higher amid Strait of Hormuz closure and attacks on Iranian port city Jask,0.25,Positive
"Tue, 03 Mar 2026 08:00:00 GMT",Unknown,"Chinese expert weighs in on impact of Strait of Hormuz blockade, Iran’s capability of controlling the strait",0.0,Neutral
"Tue, 03 Mar 2026 08:00:00 GMT",Unknown,How Iran strikes in the Strait of Hormuz pushed oil prices higher,0.25,Positive
"Tue, 03 Mar 2026 08:00:00 GMT",Unknown,US military says Strait of Hormuz not closed — Fox News,-0.03,Neutral
"Mon, 02 Mar 2026 08:00:00 GMT",Unknown,"Iran conflict disrupts global shipping as tankers are stranded, damaged",0.0,Neutral
"Tue, 03 Mar 2026 08:00:00 GMT",Unknown,Charted: Oil Trade Through the Strait of Hormuz by Country,0.0,Neutral
"Tue, 03 Mar 2026 08:00:00 GMT",Unknown,The narrow strait of water putting oil prices and freight costs on the brink,-0.13,Neutral
"Tue, 03 Mar 2026 08:00:00 GMT",Unknown,"Iran doesn't have the resources to shut Strait of Hormuz, ex-energy chief says",0.0,Neutral
"Tue, 03 Mar 2026 08:00:00 GMT",Unknown,"Iran declares Strait of Hormuz closed, warns ships not to pass",-0.1,Neutral
"Tue, 03 Mar 2026 08:00:00 GMT",Unknown,"Military support for Strait of Hormuz creates a lot of risk, says Clearview Energy's Kevin Book",-0.1,Neutral
"Tue, 03 Mar 2026 00:03:37 GMT",Unknown,"Fuel Tanker Ablaze in Strait of Hormuz After Drone Strike, Iran Revolutionary Guards Say",0.0,Neutral
"Tue, 03 Mar 2026 08:00:00 GMT",Unknown,Why is the Strait of Hormuz so vital and how could disruption affect UK bills? | ITV News,0.1,Neutral
"Tue, 03 Mar 2026 08:00:00 GMT",Unknown,Hormuz Strait paralyzed: Is Exxon more resilient than Total and Shell?,0.25,Positive
"Tue, 03 Mar 2026 08:00:00 GMT",Unknown,"Hormuz Crisis: Indian Shipowners Seek Govt Intervention; 27 Vessels Stuck, Rs 10,000-Crore Assets At Risk",0.0,Neutral
"Tue, 03 Mar 2026 08:00:00 GMT",Unknown,In the media: How is the Hormuz blockade affecting the global economy?,0.0,Neutral
"Wed, 04 Mar 2026 08:00:00 GMT",Unknown,WATCH: How traffic dried up in the Strait of Hormuz since the Iran war began,-0.2,Neutral
"Wed, 04 Mar 2026 08:00:00 GMT",Unknown,"Shipping slows to a crawl through Strait of Hormuz, threatening to snarl international trade",0.0,Neutral
"Wed, 04 Mar 2026 08:00:00 GMT",Unknown,How Iran's Strait of Hormuz shutdown could hit the global economy,0.0,Neutral
"Wed, 04 Mar 2026 08:00:00 GMT",Unknown,See the Strait of Hormuz Shutting Down,-0.16,Neutral
"Wed, 04 Mar 2026 08:00:00 GMT",Unknown,"Fact Check Team: Strait of Hormuz risks explained, US gears up to protect shipping",0.0,Neutral
"Wed, 04 Mar 2026 08:00:00 GMT",Unknown,IRGC says Iran in ‘complete control’ of Strait of Hormuz amid Trump threats,0.1,Neutral
"Wed, 04 Mar 2026 08:00:00 GMT",Unknown,"US-Iran War Puts Strait Of Hormuz Under Fire, Disrupting Global Energy Trade",0.0,Neutral
"Wed, 04 Mar 2026 08:00:00 GMT",Unknown,Strait of Hormuz: The Oil Bottleneck Threatening the Global Economy,0.0,Neutral
"Wed, 04 Mar 2026 08:00:00 GMT",Unknown,Iran closes Strait of Hormuz: Which foods will get pricier?,0.0,Neutral
"Wed, 04 Mar 2026 08:00:00 GMT",Unknown,Strait of Hormuz: Gulf states’ food security is at immediate risk but wider shortages could push up consumer prices globally,0.0,Neutral
"Wed, 04 Mar 2026 08:00:00 GMT",Unknown,Strait of Hormuz – its closure and its implications,0.0,Neutral
"Tue, 03 Mar 2026 08:00:00 GMT",Unknown,How Will the Iran Conflict Impact Oil Prices?,0.0,Neutral
"Wed, 04 Mar 2026 08:00:00 GMT",Unknown,Exxon Mobil Weighs Strait Of Hormuz Shock And Rising Oil Prices,0.0,Neutral
"Wed, 04 Mar 2026 08:00:00 GMT",Unknown,The Strait of Hormuz and Its Impact on the Global Energy Market,0.0,Neutral
"Wed, 04 Mar 2026 08:00:00 GMT",Unknown,Iran War Brings Strait of Hormuz Traffic to a Halt: Evening Briefing Americas,0.0,Neutral
"Wed, 04 Mar 2026 08:00:00 GMT",Unknown,The High Stakes of Keeping the Strait of Hormuz Open,0.09,Neutral
"Wed, 04 Mar 2026 08:00:00 GMT",Unknown,"Strait of Hormuz disruption: Which container vessels are trapped, waiting, or diverting?",-0.2,Neutral
"Wed, 04 Mar 2026 08:00:00 GMT",Unknown,What Happens If the Strait of Hormuz Stays Closed?,-0.1,Neutral
"Wed, 04 Mar 2026 08:00:00 GMT",Unknown,Strait Of Hormuz Closure And How It Can Impact African Economies,0.0,Neutral
"Wed, 04 Mar 2026 08:00:00 GMT",Unknown,What are Europe's oil route alternatives to the Strait of Hormuz?,0.0,Neutral
"Wed, 04 Mar 2026 08:00:00 GMT",Unknown,Breakingviews,0.0,Neutral
"Wed, 04 Mar 2026 08:00:00 GMT",Unknown,"Trump's Hormuz shipping plan is too little, too late in race to avert energy shock",-0.24,Negative
"Wed, 04 Mar 2026 08:00:00 GMT",Unknown,"Container ship hit in Strait of Hormuz, nearly 150 vessels trapped",-0.05,Neutral
"Wed, 04 Mar 2026 08:00:00 GMT",Unknown,Shipping Has Collapsed Through Vital Strait of Hormuz,0.1,Neutral
"Wed, 04 Mar 2026 08:00:00 GMT",Unknown,"Gulf shipping crisis deepens as tankers stranded for fifth day, US sinks Iranian warship",-0.1,Neutral
"Wed, 04 Mar 2026 08:00:00 GMT",Unknown,"Hormuz shutdown could force Iraq, Kuwait to curb oil output within days, JP Morgan says",0.0,Neutral
"Wed, 04 Mar 2026 08:00:00 GMT",Unknown,"Iran Claims It Has ""Complete Control"" Over Strait of Hormuz",-0.17,Neutral
"Wed, 04 Mar 2026 08:00:00 GMT",Unknown,Can Trump get tankers passing through the Strait of Hormuz again?,0.0,Neutral
"Wed, 04 Mar 2026 08:00:00 GMT",Unknown,Countries work to secure safe passage in the Strait of Hormuz,0.45,Positive
"Wed, 04 Mar 2026 08:00:00 GMT",Unknown,Iran's hold on Strait of Hormuz could cause delays close to home,0.0,Neutral
"Wed, 04 Mar 2026 08:00:00 GMT",Unknown,Which European countries' ships are most hit by the Hormuz crisis?,0.25,Positive
"Wed, 04 Mar 2026 08:00:00 GMT",Unknown,Iran War: Hormuz Convoys Won’t Fix Vital Oil and Gas Flows Overnight,0.1,Neutral
"Wed, 04 Mar 2026 08:00:00 GMT",Unknown,How the closing of the Strait of Hormuz is affecting global oil markets,0.0,Neutral
"Wed, 04 Mar 2026 08:00:00 GMT",Unknown,How Iran’s ‘complete control’ of the Strait of Hormuz is wreaking havoc on the world’s oil and gas supply,0.07,Neutral
"Wed, 04 Mar 2026 08:00:00 GMT",Unknown,"Shipping slows through Strait of Hormuz, impacting gas prices",0.0,Neutral
"Wed, 04 Mar 2026 08:00:00 GMT",Unknown,Energy prices start climbing after war closes Strait of Hormuz down,-0.16,Neutral
"Tue, 03 Mar 2026 08:00:00 GMT",Unknown,What to know about the Strait of Hormuz amid the widening Iran war,0.0,Neutral
"Wed, 04 Mar 2026 08:00:00 GMT",Unknown,Marine traffic 'down to zero' due to Middle East conflict,-0.08,Neutral
"Wed, 04 Mar 2026 08:00:00 GMT",Unknown,Iran’s plan to turn the Strait of Hormuz into a death trap for Trump,0.0,Neutral
"Wed, 04 Mar 2026 08:00:00 GMT",Unknown,Iran could disrupt the Strait of Hormuz with drones for months,0.0,Neutral
"Tue, 03 Mar 2026 08:00:00 GMT",Unknown,"Oil prices jump nearly 5%, settle at highest since January 2025 on Middle East conflict",0.05,Neutral
"Wed, 04 Mar 2026 08:00:00 GMT",Unknown,The 39km-wide stretch of water threatening to throw the global economy into turmoil,0.0,Neutral
"Wed, 04 Mar 2026 08:00:00 GMT",Unknown,Hormuz shutdown worsens after US hits Iranian warship; tankers stranded for fifth day,0.0,Neutral
"Wed, 04 Mar 2026 08:00:00 GMT",Unknown,Transnet ready for rerouted ships after Strait of Hormuz closure,0.2,Neutral
